"No.","Time","Source","Destination","Protocol","Length","Info"
"1","0.000000000","10.0.0.3","10.0.0.1","TCP","74","36471 > distinct [SYN] Seq=0 Win=29200 Len=0 MSS=1460 SACK_PERM=1 TSval=297307832 TSecr=0 WS=512"
"2","0.010038000","10.0.0.1","10.0.0.3","TCP","74","distinct > 36471 [SYN, ACK] Seq=0 Ack=1 Win=28960 Len=0 MSS=1460 SACK_PERM=1 TSval=297307841 TSecr=297307832 WS=512"
"3","-0.013381000","10.0.0.3","10.0.0.1","TCP","74","[TCP Retransmission] 36471 > distinct [SYN] Seq=0 Win=29200 Len=0 MSS=1460 SACK_PERM=1 TSval=297307832 TSecr=0 WS=512"
"4","-0.023386000","10.0.0.3","10.0.0.1","TCP","74","[TCP Retransmission] 36471 > distinct [SYN] Seq=0 Win=29200 Len=0 MSS=1460 SACK_PERM=1 TSval=297307832 TSecr=0 WS=512"
"5","-0.000011000","10.0.0.3","10.0.0.1","TCP","74","[TCP Retransmission] 36471 > distinct [SYN] Seq=0 Win=29200 Len=0 MSS=1460 SACK_PERM=1 TSval=297307832 TSecr=0 WS=512"
"6","-0.013351000","10.0.0.3","10.0.0.1","TCP","74","[TCP Retransmission] 36471 > distinct [SYN] Seq=0 Win=29200 Len=0 MSS=1460 SACK_PERM=1 TSval=297307832 TSecr=0 WS=512"
"7","0.023476000","10.0.0.1","10.0.0.3","TCP","74","[TCP Retransmission] distinct > 36471 [SYN, ACK] Seq=0 Ack=1 Win=28960 Len=0 MSS=1460 SACK_PERM=1 TSval=297307841 TSecr=297307832 WS=512"
"8","0.066142000","10.0.0.3","10.0.0.1","TCP","66","36471 > distinct [ACK] Seq=1 Ack=1 Win=29696 Len=0 TSval=297307850 TSecr=297307841"
"9","0.070866000","10.0.0.3","10.0.0.1","TCP","90","36471 > distinct [PSH, ACK] Seq=1 Ack=1 Win=29696 Len=24 TSval=297307850 TSecr=297307841"
"10","0.075443000","10.0.0.3","10.0.0.1","TCP","1514","36471 > distinct [ACK] Seq=25 Ack=1 Win=29696 Len=1448 TSval=297307850 TSecr=297307841"
"11","0.082451000","10.0.0.3","10.0.0.1","TCP","1514","36471 > distinct [ACK] Seq=1473 Ack=1 Win=29696 Len=1448 TSval=297307850 TSecr=297307841"
"12","0.087465000","10.0.0.3","10.0.0.1","TCP","1514","36471 > distinct [ACK] Seq=2921 Ack=1 Win=29696 Len=1448 TSval=297307850 TSecr=297307841"
"13","0.098968000","10.0.0.3","10.0.0.1","TCP","1514","36471 > distinct [ACK] Seq=4369 Ack=1 Win=29696 Len=1448 TSval=297307850 TSecr=297307841"
"14","0.101551000","10.0.0.1","10.0.0.3","TCP","66","distinct > 36471 [ACK] Seq=1 Ack=25 Win=29184 Len=0 TSval=297307862 TSecr=297307850"
"15","0.105568000","10.0.0.1","10.0.0.3","TCP","66","distinct > 36471 [ACK] Seq=1 Ack=1473 Win=32256 Len=0 TSval=297307863 TSecr=297307850"
"16","0.111077000","10.0.0.3","10.0.0.1","TCP","1514","36471 > distinct [ACK] Seq=5817 Ack=1 Win=29696 Len=1448 TSval=297307850 TSecr=297307841"
"17","0.112989000","10.0.0.1","10.0.0.3","TCP","66","distinct > 36471 [ACK] Seq=1 Ack=2921 Win=34816 Len=0 TSval=297307864 TSecr=297307850"
"18","0.117583000","10.0.0.1","10.0.0.3","TCP","66","distinct > 36471 [ACK] Seq=1 Ack=4369 Win=37888 Len=0 TSval=297307866 TSecr=297307850"
"19","0.123188000","10.0.0.3","10.0.0.1","TCP","1514","36471 > distinct [ACK] Seq=7265 Ack=1 Win=29696 Len=1448 TSval=297307850 TSecr=297307841"
"20","0.129302000","10.0.0.1","10.0.0.3","TCP","66","distinct > 36471 [ACK] Seq=1 Ack=5817 Win=40960 Len=0 TSval=297307869 TSecr=297307850"
"21","-0.013359000","10.0.0.3","10.0.0.1","TCP","74","[TCP Retransmission] 36471 > distinct [SYN] Seq=0 Win=29200 Len=0 MSS=1460 SACK_PERM=1 TSval=297307832 TSecr=0 WS=512"
"22","0.023490000","10.0.0.1","10.0.0.3","TCP","74","[TCP Retransmission] distinct > 36471 [SYN, ACK] Seq=0 Ack=1 Win=28960 Len=0 MSS=1460 SACK_PERM=1 TSval=297307841 TSecr=297307832 WS=512"
"23","0.066132000","10.0.0.3","10.0.0.1","TCP","66","36471 > distinct [ACK] Seq=1 Ack=1 Win=29696 Len=0 TSval=297307850 TSecr=297307841"
"24","0.070852000","10.0.0.3","10.0.0.1","TCP","90","[TCP Retransmission] 36471 > distinct [PSH, ACK] Seq=1 Ack=1 Win=29696 Len=24 TSval=297307850 TSecr=297307841"
"25","0.075421000","10.0.0.3","10.0.0.1","TCP","1514","[TCP Retransmission] 36471 > distinct [ACK] Seq=25 Ack=1 Win=29696 Len=1448 TSval=297307850 TSecr=297307841"
"26","0.082445000","10.0.0.3","10.0.0.1","TCP","1514","[TCP Retransmission] 36471 > distinct [ACK] Seq=1473 Ack=1 Win=29696 Len=1448 TSval=297307850 TSecr=297307841"
"27","0.087457000","10.0.0.3","10.0.0.1","TCP","1514","[TCP Retransmission] 36471 > distinct [ACK] Seq=2921 Ack=1 Win=29696 Len=1448 TSval=297307850 TSecr=297307841"
"28","0.098959000","10.0.0.3","10.0.0.1","TCP","1514","[TCP Retransmission] 36471 > distinct [ACK] Seq=4369 Ack=1 Win=29696 Len=1448 TSval=297307850 TSecr=297307841"
"29","0.101559000","10.0.0.1","10.0.0.3","TCP","66","distinct > 36471 [ACK] Seq=1 Ack=25 Win=29184 Len=0 TSval=297307862 TSecr=297307850"
"30","0.105575000","10.0.0.1","10.0.0.3","TCP","66","distinct > 36471 [ACK] Seq=1 Ack=1473 Win=32256 Len=0 TSval=297307863 TSecr=297307850"
"31","0.111069000","10.0.0.3","10.0.0.1","TCP","1514","[TCP Retransmission] 36471 > distinct [ACK] Seq=5817 Ack=1 Win=29696 Len=1448 TSval=297307850 TSecr=297307841"
"32","0.112993000","10.0.0.1","10.0.0.3","TCP","66","distinct > 36471 [ACK] Seq=1 Ack=2921 Win=34816 Len=0 TSval=297307864 TSecr=297307850"
"33","0.117587000","10.0.0.1","10.0.0.3","TCP","66","distinct > 36471 [ACK] Seq=1 Ack=4369 Win=37888 Len=0 TSval=297307866 TSecr=297307850"
"34","0.123181000","10.0.0.3","10.0.0.1","TCP","1514","[TCP Retransmission] 36471 > distinct [ACK] Seq=7265 Ack=1 Win=29696 Len=1448 TSval=297307850 TSecr=297307841"
"35","0.129309000","10.0.0.1","10.0.0.3","TCP","66","distinct > 36471 [ACK] Seq=1 Ack=5817 Win=40960 Len=0 TSval=297307869 TSecr=297307850"
"36","0.135298000","10.0.0.3","10.0.0.1","TCP","1514","36471 > distinct [ACK] Seq=8713 Ack=1 Win=29696 Len=1448 TSval=297307850 TSecr=297307841"
"37","0.141191000","10.0.0.1","10.0.0.3","TCP","66","distinct > 36471 [ACK] Seq=1 Ack=7265 Win=43520 Len=0 TSval=297307871 TSecr=297307850"
"38","0.147410000","10.0.0.3","10.0.0.1","TCP","1514","36471 > distinct [ACK] Seq=10161 Ack=1 Win=29696 Len=1448 TSval=297307850 TSecr=297307841"
"39","0.153287000","10.0.0.1","10.0.0.3","TCP","66","distinct > 36471 [ACK] Seq=1 Ack=8713 Win=46592 Len=0 TSval=297307875 TSecr=297307850"
"40","0.159518000","10.0.0.3","10.0.0.1","TCP","1514","36471 > distinct [ACK] Seq=11609 Ack=1 Win=29696 Len=1448 TSval=297307850 TSecr=297307841"
"41","0.165899000","10.0.0.1","10.0.0.3","TCP","66","distinct > 36471 [ACK] Seq=1 Ack=10161 Win=49664 Len=0 TSval=297307878 TSecr=297307850"
"42","0.171633000","10.0.0.3","10.0.0.1","TCP","1514","36471 > distinct [ACK] Seq=13057 Ack=1 Win=29696 Len=1448 TSval=297307869 TSecr=297307862"
"43","-0.025936000","10.0.0.3","10.0.0.1","TCP","74","[TCP Retransmission] 36471 > distinct [SYN] Seq=0 Win=29200 Len=0 MSS=1460 SACK_PERM=1 TSval=297307832 TSecr=0 WS=512"
"44","0.035778000","10.0.0.1","10.0.0.3","TCP","74","[TCP Retransmission] distinct > 36471 [SYN, ACK] Seq=0 Ack=1 Win=28960 Len=0 MSS=1460 SACK_PERM=1 TSval=297307841 TSecr=297307832 WS=512"
"45","0.045820000","10.0.0.3","10.0.0.1","TCP","66","36471 > distinct [ACK] Seq=1 Ack=1 Win=29696 Len=0 TSval=297307850 TSecr=297307841"
"46","0.045860000","10.0.0.3","10.0.0.1","TCP","90","[TCP Retransmission] 36471 > distinct [PSH, ACK] Seq=1 Ack=1 Win=29696 Len=24 TSval=297307850 TSecr=297307841"
"47","0.045914000","10.0.0.3","10.0.0.1","TCP","1514","[TCP Retransmission] 36471 > distinct [ACK] Seq=25 Ack=1 Win=29696 Len=1448 TSval=297307850 TSecr=297307841"
"48","0.045923000","10.0.0.3","10.0.0.1","TCP","1514","[TCP Retransmission] 36471 > distinct [ACK] Seq=1473 Ack=1 Win=29696 Len=1448 TSval=297307850 TSecr=297307841"
"49","0.046031000","10.0.0.3","10.0.0.1","TCP","1514","[TCP Retransmission] 36471 > distinct [ACK] Seq=2921 Ack=1 Win=29696 Len=1448 TSval=297307850 TSecr=297307841"
"50","0.046151000","10.0.0.3","10.0.0.1","TCP","1514","[TCP Retransmission] 36471 > distinct [ACK] Seq=4369 Ack=1 Win=29696 Len=1448 TSval=297307850 TSecr=297307841"
"51","0.046276000","10.0.0.3","10.0.0.1","TCP","1514","[TCP Retransmission] 36471 > distinct [ACK] Seq=5817 Ack=1 Win=29696 Len=1448 TSval=297307850 TSecr=297307841"
"52","0.046394000","10.0.0.3","10.0.0.1","TCP","1514","[TCP Retransmission] 36471 > distinct [ACK] Seq=7265 Ack=1 Win=29696 Len=1448 TSval=297307850 TSecr=297307841"
"53","0.046516000","10.0.0.3","10.0.0.1","TCP","1514","[TCP Retransmission] 36471 > distinct [ACK] Seq=8713 Ack=1 Win=29696 Len=1448 TSval=297307850 TSecr=297307841"
"54","0.046639000","10.0.0.3","10.0.0.1","TCP","1514","[TCP Retransmission] 36471 > distinct [ACK] Seq=10161 Ack=1 Win=29696 Len=1448 TSval=297307850 TSecr=297307841"
"55","0.046764000","10.0.0.3","10.0.0.1","TCP","1514","[TCP Retransmission] 36471 > distinct [ACK] Seq=11609 Ack=1 Win=29696 Len=1448 TSval=297307850 TSecr=297307841"
"56","0.111651000","10.0.0.1","10.0.0.3","TCP","66","distinct > 36471 [ACK] Seq=1 Ack=25 Win=29184 Len=0 TSval=297307862 TSecr=297307850"
"57","0.115591000","10.0.0.1","10.0.0.3","TCP","66","distinct > 36471 [ACK] Seq=1 Ack=1473 Win=32256 Len=0 TSval=297307863 TSecr=297307850"
"58","0.121686000","10.0.0.3","10.0.0.1","TCP","2962","[TCP Retransmission] 36471 > distinct [ACK] Seq=13057 Ack=1 Win=29696 Len=2896 TSval=297307869 TSecr=297307862"
"59","0.123020000","10.0.0.1","10.0.0.3","TCP","66","distinct > 36471 [ACK] Seq=1 Ack=2921 Win=34816 Len=0 TSval=297307864 TSecr=297307850"
"60","0.125622000","10.0.0.3","10.0.0.1","TCP","2962","36471 > distinct [ACK] Seq=15953 Ack=1 Win=29696 Len=2896 TSval=297307870 TSecr=297307863"
"61","0.127608000","10.0.0.1","10.0.0.3","TCP","66","distinct > 36471 [ACK] Seq=1 Ack=4369 Win=37888 Len=0 TSval=297307866 TSecr=297307850"
"62","0.133077000","10.0.0.3","10.0.0.1","TCP","2962","36471 > distinct [ACK] Seq=18849 Ack=1 Win=29696 Len=2896 TSval=297307872 TSecr=297307864"
"63","0.137661000","10.0.0.3","10.0.0.1","TCP","2962","36471 > distinct [ACK] Seq=21745 Ack=1 Win=29696 Len=2896 TSval=297307873 TSecr=297307866"
"64","0.139329000","10.0.0.1","10.0.0.3","TCP","66","distinct > 36471 [ACK] Seq=1 Ack=5817 Win=40960 Len=0 TSval=297307869 TSecr=297307850"
"65","0.149386000","10.0.0.3","10.0.0.1","TCP","2962","36471 > distinct [ACK] Seq=24641 Ack=1 Win=29696 Len=2896 TSval=297307876 TSecr=297307869"
"66","0.151224000","10.0.0.1","10.0.0.3","TCP","66","distinct > 36471 [ACK] Seq=1 Ack=7265 Win=43520 Len=0 TSval=297307871 TSecr=297307850"
"67","0.161259000","10.0.0.3","10.0.0.1","TCP","2962","36471 > distinct [ACK] Seq=27537 Ack=1 Win=29696 Len=2896 TSval=297307879 TSecr=297307871"
"68","0.163314000","10.0.0.1","10.0.0.3","TCP","66","distinct > 36471 [ACK] Seq=1 Ack=8713 Win=46592 Len=0 TSval=297307875 TSecr=297307850"
"69","0.173357000","10.0.0.3","10.0.0.1","TCP","2962","36471 > distinct [ACK] Seq=30433 Ack=1 Win=29696 Len=2896 TSval=297307882 TSecr=297307875"
"70","0.175928000","10.0.0.1","10.0.0.3","TCP","66","distinct > 36471 [ACK] Seq=1 Ack=10161 Win=49664 Len=0 TSval=297307878 TSecr=297307850"
"71","0.185973000","10.0.0.3","10.0.0.1","TCP","2962","36471 > distinct [ACK] Seq=33329 Ack=1 Win=29696 Len=2896 TSval=297307885 TSecr=297307878"
"72","0.187579000","10.0.0.1","10.0.0.3","TCP","66","distinct > 36471 [ACK] Seq=1 Ack=11609 Win=52224 Len=0 TSval=297307881 TSecr=297307850"
"73","0.197618000","10.0.0.3","10.0.0.1","TCP","2962","36471 > distinct [ACK] Seq=36225 Ack=1 Win=29696 Len=2896 TSval=297307888 TSecr=297307881"
"74","0.199646000","10.0.0.1","10.0.0.3","TCP","66","distinct > 36471 [ACK] Seq=1 Ack=13057 Win=55296 Len=0 TSval=297307884 TSecr=297307850"
"75","0.209691000","10.0.0.3","10.0.0.1","TCP","2962","36471 > distinct [ACK] Seq=39121 Ack=1 Win=29696 Len=2896 TSval=297307891 TSecr=297307884"
"76","0.211957000","10.0.0.1","10.0.0.3","TCP","66","distinct > 36471 [ACK] Seq=1 Ack=14505 Win=58368 Len=0 TSval=297307887 TSecr=297307869"
"77","-0.010013000","10.0.0.3","10.0.0.1","TCP","74","[TCP Retransmission] 36471 > distinct [SYN] Seq=0 Win=29200 Len=0 MSS=1460 SACK_PERM=1 TSval=297307832 TSecr=0 WS=512"
"78","0.076642000","10.0.0.3","10.0.0.1","TCP","66","36471 > distinct [ACK] Seq=1 Ack=1 Win=29696 Len=0 TSval=297307850 TSecr=297307841"
"79","0.081002000","10.0.0.3","10.0.0.1","TCP","90","[TCP Retransmission] 36471 > distinct [PSH, ACK] Seq=1 Ack=1 Win=29696 Len=24 TSval=297307850 TSecr=297307841"
"80","0.085485000","10.0.0.3","10.0.0.1","TCP","1514","[TCP Retransmission] 36471 > distinct [ACK] Seq=25 Ack=1 Win=29696 Len=1448 TSval=297307850 TSecr=297307841"
"81","0.091492000","10.0.0.1","10.0.0.3","TCP","66","distinct > 36471 [ACK] Seq=1 Ack=25 Win=29184 Len=0 TSval=297307862 TSecr=297307850"
"82","0.092466000","10.0.0.3","10.0.0.1","TCP","1514","[TCP Retransmission] 36471 > distinct [ACK] Seq=1473 Ack=1 Win=29696 Len=1448 TSval=297307850 TSecr=297307841"
"83","0.095546000","10.0.0.1","10.0.0.3","TCP","66","distinct > 36471 [ACK] Seq=1 Ack=1473 Win=32256 Len=0 TSval=297307863 TSecr=297307850"
"84","0.097486000","10.0.0.3","10.0.0.1","TCP","1514","[TCP Retransmission] 36471 > distinct [ACK] Seq=2921 Ack=1 Win=29696 Len=1448 TSval=297307850 TSecr=297307841"
"85","0.102961000","10.0.0.1","10.0.0.3","TCP","66","distinct > 36471 [ACK] Seq=1 Ack=2921 Win=34816 Len=0 TSval=297307864 TSecr=297307850"
"86","0.107554000","10.0.0.1","10.0.0.3","TCP","66","distinct > 36471 [ACK] Seq=1 Ack=4369 Win=37888 Len=0 TSval=297307866 TSecr=297307850"
"87","0.108988000","10.0.0.3","10.0.0.1","TCP","1514","[TCP Retransmission] 36471 > distinct [ACK] Seq=4369 Ack=1 Win=29696 Len=1448 TSval=297307850 TSecr=297307841"
"88","0.119284000","10.0.0.1","10.0.0.3","TCP","66","distinct > 36471 [ACK] Seq=1 Ack=5817 Win=40960 Len=0 TSval=297307869 TSecr=297307850"
"89","0.121098000","10.0.0.3","10.0.0.1","TCP","1514","[TCP Retransmission] 36471 > distinct [ACK] Seq=5817 Ack=1 Win=29696 Len=1448 TSval=297307850 TSecr=297307841"
"90","0.131148000","10.0.0.1","10.0.0.3","TCP","66","distinct > 36471 [ACK] Seq=1 Ack=7265 Win=43520 Len=0 TSval=297307871 TSecr=297307850"
"91","0.133209000","10.0.0.3","10.0.0.1","TCP","1514","[TCP Retransmission] 36471 > distinct [ACK] Seq=7265 Ack=1 Win=29696 Len=1448 TSval=297307850 TSecr=297307841"
"92","0.143252000","10.0.0.1","10.0.0.3","TCP","66","distinct > 36471 [ACK] Seq=1 Ack=8713 Win=46592 Len=0 TSval=297307875 TSecr=297307850"
"93","0.145335000","10.0.0.3","10.0.0.1","TCP","1514","[TCP Retransmission] 36471 > distinct [ACK] Seq=8713 Ack=1 Win=29696 Len=1448 TSval=297307850 TSecr=297307841"
"94","0.155865000","10.0.0.1","10.0.0.3","TCP","66","distinct > 36471 [ACK] Seq=1 Ack=10161 Win=49664 Len=0 TSval=297307878 TSecr=297307850"
"95","0.157451000","10.0.0.3","10.0.0.1","TCP","1514","[TCP Retransmission] 36471 > distinct [ACK] Seq=10161 Ack=1 Win=29696 Len=1448 TSval=297307850 TSecr=297307841"
"96","0.167510000","10.0.0.1","10.0.0.3","TCP","66","distinct > 36471 [ACK] Seq=1 Ack=11609 Win=52224 Len=0 TSval=297307881 TSecr=297307850"
"97","0.169545000","10.0.0.3","10.0.0.1","TCP","1514","[TCP Retransmission] 36471 > distinct [ACK] Seq=11609 Ack=1 Win=29696 Len=1448 TSval=297307850 TSecr=297307841"
"98","0.179587000","10.0.0.1","10.0.0.3","TCP","66","distinct > 36471 [ACK] Seq=1 Ack=13057 Win=55296 Len=0 TSval=297307884 TSecr=297307850"
"99","0.181666000","10.0.0.3","10.0.0.1","TCP","1514","[TCP Retransmission] 36471 > distinct [ACK] Seq=13057 Ack=1 Win=29696 Len=1448 TSval=297307869 TSecr=297307862"
"100","0.191905000","10.0.0.1","10.0.0.3","TCP","66","distinct > 36471 [ACK] Seq=1 Ack=14505 Win=58368 Len=0 TSval=297307887 TSecr=297307869"
"101","0.193782000","10.0.0.3","10.0.0.1","TCP","1514","[TCP Retransmission] 36471 > distinct [ACK] Seq=14505 Ack=1 Win=29696 Len=1448 TSval=297307869 TSecr=297307862"
"102","0.203833000","10.0.0.1","10.0.0.3","TCP","66","distinct > 36471 [ACK] Seq=1 Ack=15953 Win=60928 Len=0 TSval=297307890 TSecr=297307869"
"103","0.205885000","10.0.0.3","10.0.0.1","TCP","2962","[TCP Retransmission] 36471 > distinct [ACK] Seq=15953 Ack=1 Win=29696 Len=2896 TSval=297307870 TSecr=297307863"
"104","0.215998000","10.0.0.1","10.0.0.3","TCP","66","distinct > 36471 [ACK] Seq=1 Ack=18849 Win=67072 Len=0 TSval=297307893 TSecr=297307870"
"105","0.230127000","10.0.0.3","10.0.0.1","TCP","2962","[TCP Retransmission] 36471 > distinct [ACK] Seq=18849 Ack=1 Win=29696 Len=2896 TSval=297307872 TSecr=297307864"
"106","0.240288000","10.0.0.1","10.0.0.3","TCP","66","distinct > 36471 [ACK] Seq=1 Ack=21745 Win=72704 Len=0 TSval=297307899 TSecr=297307872"
"107","0.254349000","10.0.0.3","10.0.0.1","TCP","2962","[TCP Retransmission] 36471 > distinct [ACK] Seq=21745 Ack=1 Win=29696 Len=2896 TSval=297307873 TSecr=297307866"
"108","0.264423000","10.0.0.1","10.0.0.3","TCP","66","distinct > 36471 [ACK] Seq=1 Ack=24641 Win=78336 Len=0 TSval=297307905 TSecr=297307873"
"109","0.135309000","10.0.0.3","10.0.0.1","TCP","1514","[TCP Retransmission] 36471 > distinct [ACK] Seq=8713 Ack=1 Win=29696 Len=1448 TSval=297307850 TSecr=297307841"
"110","0.141180000","10.0.0.1","10.0.0.3","TCP","66","distinct > 36471 [ACK] Seq=1 Ack=7265 Win=43520 Len=0 TSval=297307871 TSecr=297307850"
"111","0.147422000","10.0.0.3","10.0.0.1","TCP","1514","[TCP Retransmission] 36471 > distinct [ACK] Seq=10161 Ack=1 Win=29696 Len=1448 TSval=297307850 TSecr=297307841"
"112","0.153276000","10.0.0.1","10.0.0.3","TCP","66","distinct > 36471 [ACK] Seq=1 Ack=8713 Win=46592 Len=0 TSval=297307875 TSecr=297307850"
"113","0.159526000","10.0.0.3","10.0.0.1","TCP","1514","[TCP Retransmission] 36471 > distinct [ACK] Seq=11609 Ack=1 Win=29696 Len=1448 TSval=297307850 TSecr=297307841"
"114","0.165889000","10.0.0.1","10.0.0.3","TCP","66","distinct > 36471 [ACK] Seq=1 Ack=10161 Win=49664 Len=0 TSval=297307878 TSecr=297307850"
"115","0.171643000","10.0.0.3","10.0.0.1","TCP","1514","[TCP Retransmission] 36471 > distinct [ACK] Seq=13057 Ack=1 Win=29696 Len=1448 TSval=297307869 TSecr=297307862"
"116","0.177541000","10.0.0.1","10.0.0.3","TCP","66","distinct > 36471 [ACK] Seq=1 Ack=11609 Win=52224 Len=0 TSval=297307881 TSecr=297307850"
"117","0.183755000","10.0.0.3","10.0.0.1","TCP","1514","[TCP Retransmission] 36471 > distinct [ACK] Seq=14505 Ack=1 Win=29696 Len=1448 TSval=297307869 TSecr=297307862"
"118","0.189613000","10.0.0.1","10.0.0.3","TCP","66","distinct > 36471 [ACK] Seq=1 Ack=13057 Win=55296 Len=0 TSval=297307884 TSecr=297307850"
"119","0.195865000","10.0.0.3","10.0.0.1","TCP","2962","[TCP Retransmission] 36471 > distinct [ACK] Seq=15953 Ack=1 Win=29696 Len=2896 TSval=297307870 TSecr=297307863"
"120","0.201931000","10.0.0.1","10.0.0.3","TCP","66","distinct > 36471 [ACK] Seq=1 Ack=14505 Win=58368 Len=0 TSval=297307887 TSecr=297307869"
"121","0.213866000","10.0.0.1","10.0.0.3","TCP","66","distinct > 36471 [ACK] Seq=1 Ack=15953 Win=60928 Len=0 TSval=297307890 TSecr=297307869"
"122","0.220095000","10.0.0.3","10.0.0.1","TCP","2962","[TCP Retransmission] 36471 > distinct [ACK] Seq=18849 Ack=1 Win=29696 Len=2896 TSval=297307872 TSecr=297307864"
"123","0.226022000","10.0.0.1","10.0.0.3","TCP","66","distinct > 36471 [ACK] Seq=1 Ack=18849 Win=67072 Len=0 TSval=297307893 TSecr=297307870"
"124","0.244315000","10.0.0.3","10.0.0.1","TCP","2962","[TCP Retransmission] 36471 > distinct [ACK] Seq=21745 Ack=1 Win=29696 Len=2896 TSval=297307873 TSecr=297307866"
"125","0.250311000","10.0.0.1","10.0.0.3","TCP","66","distinct > 36471 [ACK] Seq=1 Ack=21745 Win=72704 Len=0 TSval=297307899 TSecr=297307872"
"126","0.268537000","10.0.0.3","10.0.0.1","TCP","2962","[TCP Retransmission] 36471 > distinct [ACK] Seq=24641 Ack=1 Win=29696 Len=2896 TSval=297307876 TSecr=297307869"
"127","0.274458000","10.0.0.1","10.0.0.3","TCP","66","distinct > 36471 [ACK] Seq=1 Ack=24641 Win=78336 Len=0 TSval=297307905 TSecr=297307873"
"128","0.292765000","10.0.0.3","10.0.0.1","TCP","2962","[TCP Retransmission] 36471 > distinct [ACK] Seq=27537 Ack=1 Win=29696 Len=2896 TSval=297307879 TSecr=297307871"
"129","0.298807000","10.0.0.1","10.0.0.3","TCP","66","distinct > 36471 [ACK] Seq=1 Ack=27537 Win=84480 Len=0 TSval=297307911 TSecr=297307876"
"130","0.316987000","10.0.0.3","10.0.0.1","TCP","2962","[TCP Retransmission] 36471 > distinct [ACK] Seq=30433 Ack=1 Win=29696 Len=2896 TSval=297307882 TSecr=297307875"
"131","0.322873000","10.0.0.1","10.0.0.3","TCP","66","distinct > 36471 [ACK] Seq=1 Ack=30433 Win=90112 Len=0 TSval=297307917 TSecr=297307879"
"132","0.341214000","10.0.0.3","10.0.0.1","TCP","2962","[TCP Retransmission] 36471 > distinct [ACK] Seq=33329 Ack=1 Win=29696 Len=2896 TSval=297307885 TSecr=297307878"
"133","0.347087000","10.0.0.1","10.0.0.3","TCP","66","distinct > 36471 [ACK] Seq=1 Ack=33329 Win=95744 Len=0 TSval=297307923 TSecr=297307882"
"134","0.365435000","10.0.0.3","10.0.0.1","TCP","2962","[TCP Retransmission] 36471 > distinct [ACK] Seq=36225 Ack=1 Win=29696 Len=2896 TSval=297307888 TSecr=297307881"
"135","0.373330000","10.0.0.1","10.0.0.3","TCP","66","distinct > 36471 [ACK] Seq=1 Ack=36225 Win=101376 Len=0 TSval=297307930 TSecr=297307885"
"136","0.177551000","10.0.0.1","10.0.0.3","TCP","66","distinct > 36471 [ACK] Seq=1 Ack=11609 Win=52224 Len=0 TSval=297307881 TSecr=297307850"
"137","0.183746000","10.0.0.3","10.0.0.1","TCP","1514","[TCP Retransmission] 36471 > distinct [ACK] Seq=14505 Ack=1 Win=29696 Len=1448 TSval=297307869 TSecr=297307862"
"138","0.189620000","10.0.0.1","10.0.0.3","TCP","66","distinct > 36471 [ACK] Seq=1 Ack=13057 Win=55296 Len=0 TSval=297307884 TSecr=297307850"
"139","0.195855000","10.0.0.3","10.0.0.1","TCP","2962","[TCP Retransmission] 36471 > distinct [ACK] Seq=15953 Ack=1 Win=29696 Len=2896 TSval=297307870 TSecr=297307863"
"140","0.201939000","10.0.0.1","10.0.0.3","TCP","66","distinct > 36471 [ACK] Seq=1 Ack=14505 Win=58368 Len=0 TSval=297307887 TSecr=297307869"
"141","0.213876000","10.0.0.1","10.0.0.3","TCP","66","distinct > 36471 [ACK] Seq=1 Ack=15953 Win=60928 Len=0 TSval=297307890 TSecr=297307869"
"142","0.220083000","10.0.0.3","10.0.0.1","TCP","2962","[TCP Retransmission] 36471 > distinct [ACK] Seq=18849 Ack=1 Win=29696 Len=2896 TSval=297307872 TSecr=297307864"
"143","0.226037000","10.0.0.1","10.0.0.3","TCP","66","distinct > 36471 [ACK] Seq=1 Ack=18849 Win=67072 Len=0 TSval=297307893 TSecr=297307870"
"144","0.244305000","10.0.0.3","10.0.0.1","TCP","2962","[TCP Retransmission] 36471 > distinct [ACK] Seq=21745 Ack=1 Win=29696 Len=2896 TSval=297307873 TSecr=297307866"
"145","0.250321000","10.0.0.1","10.0.0.3","TCP","66","distinct > 36471 [ACK] Seq=1 Ack=21745 Win=72704 Len=0 TSval=297307899 TSecr=297307872"
"146","0.268527000","10.0.0.3","10.0.0.1","TCP","2962","[TCP Retransmission] 36471 > distinct [ACK] Seq=24641 Ack=1 Win=29696 Len=2896 TSval=297307876 TSecr=297307869"
"147","0.274470000","10.0.0.1","10.0.0.3","TCP","66","distinct > 36471 [ACK] Seq=1 Ack=24641 Win=78336 Len=0 TSval=297307905 TSecr=297307873"
"148","0.292754000","10.0.0.3","10.0.0.1","TCP","2962","[TCP Retransmission] 36471 > distinct [ACK] Seq=27537 Ack=1 Win=29696 Len=2896 TSval=297307879 TSecr=297307871"
"149","0.298814000","10.0.0.1","10.0.0.3","TCP","66","distinct > 36471 [ACK] Seq=1 Ack=27537 Win=84480 Len=0 TSval=297307911 TSecr=297307876"
"150","0.316975000","10.0.0.3","10.0.0.1","TCP","2962","[TCP Retransmission] 36471 > distinct [ACK] Seq=30433 Ack=1 Win=29696 Len=2896 TSval=297307882 TSecr=297307875"
"151","0.322881000","10.0.0.1","10.0.0.3","TCP","66","distinct > 36471 [ACK] Seq=1 Ack=30433 Win=90112 Len=0 TSval=297307917 TSecr=297307879"
"152","0.341202000","10.0.0.3","10.0.0.1","TCP","2962","[TCP Retransmission] 36471 > distinct [ACK] Seq=33329 Ack=1 Win=29696 Len=2896 TSval=297307885 TSecr=297307878"
"153","0.347095000","10.0.0.1","10.0.0.3","TCP","66","distinct > 36471 [ACK] Seq=1 Ack=33329 Win=95744 Len=0 TSval=297307923 TSecr=297307882"
"154","0.365424000","10.0.0.3","10.0.0.1","TCP","2962","[TCP Retransmission] 36471 > distinct [ACK] Seq=36225 Ack=1 Win=29696 Len=2896 TSval=297307888 TSecr=297307881"
"155","0.373340000","10.0.0.1","10.0.0.3","TCP","66","distinct > 36471 [ACK] Seq=1 Ack=36225 Win=101376 Len=0 TSval=297307930 TSecr=297307885"
"156","0.389649000","10.0.0.3","10.0.0.1","TCP","2962","[TCP Retransmission] 36471 > distinct [ACK] Seq=39121 Ack=1 Win=29696 Len=2896 TSval=297307891 TSecr=297307884"
"157","0.395663000","10.0.0.1","10.0.0.3","TCP","66","distinct > 36471 [ACK] Seq=1 Ack=39121 Win=107520 Len=0 TSval=297307935 TSecr=297307888"
"158","0.413874000","10.0.0.3","10.0.0.1","TCP","2962","36471 > distinct [ACK] Seq=42017 Ack=1 Win=29696 Len=2896 TSval=297307894 TSecr=297307887"
"159","0.419990000","10.0.0.1","10.0.0.3","TCP","66","distinct > 36471 [ACK] Seq=1 Ack=42017 Win=113152 Len=0 TSval=297307941 TSecr=297307891"
"160","0.221990000","10.0.0.3","10.0.0.1","TCP","2962","[TCP Retransmission] 36471 > distinct [ACK] Seq=42017 Ack=1 Win=29696 Len=2896 TSval=297307894 TSecr=297307887"
"161","0.223899000","10.0.0.1","10.0.0.3","TCP","66","distinct > 36471 [ACK] Seq=1 Ack=15953 Win=60928 Len=0 TSval=297307890 TSecr=297307869"
"162","0.233936000","10.0.0.3","10.0.0.1","TCP","2962","36471 > distinct [ACK] Seq=44913 Ack=1 Win=29696 Len=2896 TSval=297307897 TSecr=297307890"
"163","0.236061000","10.0.0.1","10.0.0.3","TCP","66","distinct > 36471 [ACK] Seq=1 Ack=18849 Win=67072 Len=0 TSval=297307893 TSecr=297307870"
"164","0.246097000","10.0.0.3","10.0.0.1","TCP","2962","36471 > distinct [ACK] Seq=47809 Ack=1 Win=29696 Len=2896 TSval=297307900 TSecr=297307893"
"165","0.246211000","10.0.0.3","10.0.0.1","TCP","2962","36471 > distinct [ACK] Seq=50705 Ack=1 Win=29696 Len=2896 TSval=297307900 TSecr=297307893"
"166","0.260342000","10.0.0.1","10.0.0.3","TCP","66","distinct > 36471 [ACK] Seq=1 Ack=21745 Win=72704 Len=0 TSval=297307899 TSecr=297307872"
"167","0.270387000","10.0.0.3","10.0.0.1","TCP","2962","36471 > distinct [ACK] Seq=53601 Ack=1 Win=29696 Len=2896 TSval=297307906 TSecr=297307899"
"168","0.270500000","10.0.0.3","10.0.0.1","TCP","2962","36471 > distinct [ACK] Seq=56497 Ack=1 Win=29696 Len=2896 TSval=297307906 TSecr=297307899"
"169","0.284506000","10.0.0.1","10.0.0.3","TCP","66","distinct > 36471 [ACK] Seq=1 Ack=24641 Win=78336 Len=0 TSval=297307905 TSecr=297307873"
"170","0.294560000","10.0.0.3","10.0.0.1","TCP","2962","36471 > distinct [PSH, ACK] Seq=59393 Ack=1 Win=29696 Len=2896 TSval=297307912 TSecr=297307905"
"171","0.294677000","10.0.0.3","10.0.0.1","TCP","2962","36471 > distinct [ACK] Seq=62289 Ack=1 Win=29696 Len=2896 TSval=297307912 TSecr=297307905"
"172","0.308832000","10.0.0.1","10.0.0.3","TCP","66","distinct > 36471 [ACK] Seq=1 Ack=27537 Win=84480 Len=0 TSval=297307911 TSecr=297307876"
"173","0.318869000","10.0.0.3","10.0.0.1","TCP","2962","36471 > distinct [ACK] Seq=65185 Ack=1 Win=29696 Len=2896 TSval=297307918 TSecr=297307911"
"174","0.318981000","10.0.0.3","10.0.0.1","TCP","2962","36471 > distinct [ACK] Seq=68081 Ack=1 Win=29696 Len=2896 TSval=297307918 TSecr=297307911"
"175","0.332906000","10.0.0.1","10.0.0.3","TCP","66","distinct > 36471 [ACK] Seq=1 Ack=30433 Win=90112 Len=0 TSval=297307917 TSecr=297307879"
"176","0.342954000","10.0.0.3","10.0.0.1","TCP","2962","36471 > distinct [ACK] Seq=70977 Ack=1 Win=29696 Len=2896 TSval=297307924 TSecr=297307917"
"177","0.343067000","10.0.0.3","10.0.0.1","TCP","2962","36471 > distinct [ACK] Seq=73873 Ack=1 Win=29696 Len=2896 TSval=297307924 TSecr=297307917"
"178","0.357122000","10.0.0.1","10.0.0.3","TCP","66","distinct > 36471 [ACK] Seq=1 Ack=33329 Win=95744 Len=0 TSval=297307923 TSecr=297307882"
"179","0.367188000","10.0.0.3","10.0.0.1","TCP","2962","36471 > distinct [ACK] Seq=76769 Ack=1 Win=29696 Len=2896 TSval=297307930 TSecr=297307923"
"180","0.367303000","10.0.0.3","10.0.0.1","TCP","2962","36471 > distinct [ACK] Seq=79665 Ack=1 Win=29696 Len=2896 TSval=297307931 TSecr=297307923"
"181","0.383356000","10.0.0.1","10.0.0.3","TCP","66","distinct > 36471 [ACK] Seq=1 Ack=36225 Win=101376 Len=0 TSval=297307930 TSecr=297307885"
"182","0.393395000","10.0.0.3","10.0.0.1","TCP","2962","36471 > distinct [ACK] Seq=82561 Ack=1 Win=29696 Len=2896 TSval=297307937 TSecr=297307930"
"183","0.393508000","10.0.0.3","10.0.0.1","TCP","2962","36471 > distinct [PSH, ACK] Seq=85457 Ack=1 Win=29696 Len=2896 TSval=297307937 TSecr=297307930"
"184","0.405691000","10.0.0.1","10.0.0.3","TCP","66","distinct > 36471 [ACK] Seq=1 Ack=39121 Win=107520 Len=0 TSval=297307935 TSecr=297307888"
"185","0.415756000","10.0.0.3","10.0.0.1","TCP","1408","36471 > distinct [PSH, ACK] Seq=88353 Ack=1 Win=29696 Len=1342 TSval=297307943 TSecr=297307935"
"186","0.415790000","10.0.0.3","10.0.0.1","TCP","1514","36471 > distinct [ACK] Seq=89695 Ack=1 Win=29696 Len=1448 TSval=297307943 TSecr=297307935"
"187","0.415862000","10.0.0.3","10.0.0.1","TCP","1514","36471 > distinct [ACK] Seq=91143 Ack=1 Win=29696 Len=1448 TSval=297307943 TSecr=297307935"
"188","0.430018000","10.0.0.1","10.0.0.3","TCP","66","distinct > 36471 [ACK] Seq=1 Ack=42017 Win=113152 Len=0 TSval=297307941 TSecr=297307891"
"189","0.440055000","10.0.0.3","10.0.0.1","TCP","2962","36471 > distinct [ACK] Seq=92591 Ack=1 Win=29696 Len=2896 TSval=297307949 TSecr=297307941"
"190","0.454074000","10.0.0.1","10.0.0.3","TCP","66","distinct > 36471 [ACK] Seq=1 Ack=44913 Win=118784 Len=0 TSval=297307947 TSecr=297307894"
"191","0.464109000","10.0.0.3","10.0.0.1","TCP","2962","36471 > distinct [ACK] Seq=95487 Ack=1 Win=29696 Len=2896 TSval=297307955 TSecr=297307947"
"192","0.278559000","10.0.0.3","10.0.0.1","TCP","2962","[TCP Retransmission] 36471 > distinct [ACK] Seq=24641 Ack=1 Win=29696 Len=2896 TSval=297307876 TSecr=297307869"
"193","0.288783000","10.0.0.1","10.0.0.3","TCP","66","distinct > 36471 [ACK] Seq=1 Ack=27537 Win=84480 Len=0 TSval=297307911 TSecr=297307876"
"194","0.302791000","10.0.0.3","10.0.0.1","TCP","2962","[TCP Retransmission] 36471 > distinct [ACK] Seq=27537 Ack=1 Win=29696 Len=2896 TSval=297307879 TSecr=297307871"
"195","0.312841000","10.0.0.1","10.0.0.3","TCP","66","distinct > 36471 [ACK] Seq=1 Ack=30433 Win=90112 Len=0 TSval=297307917 TSecr=297307879"
"196","0.327014000","10.0.0.3","10.0.0.1","TCP","2962","[TCP Retransmission] 36471 > distinct [ACK] Seq=30433 Ack=1 Win=29696 Len=2896 TSval=297307882 TSecr=297307875"
"197","0.337066000","10.0.0.1","10.0.0.3","TCP","66","distinct > 36471 [ACK] Seq=1 Ack=33329 Win=95744 Len=0 TSval=297307923 TSecr=297307882"
"198","0.351241000","10.0.0.3","10.0.0.1","TCP","2962","[TCP Retransmission] 36471 > distinct [ACK] Seq=33329 Ack=1 Win=29696 Len=2896 TSval=297307885 TSecr=297307878"
"199","0.363301000","10.0.0.1","10.0.0.3","TCP","66","distinct > 36471 [ACK] Seq=1 Ack=36225 Win=101376 Len=0 TSval=297307930 TSecr=297307885"
"200","0.375456000","10.0.0.3","10.0.0.1","TCP","2962","[TCP Retransmission] 36471 > distinct [ACK] Seq=36225 Ack=1 Win=29696 Len=2896 TSval=297307888 TSecr=297307881"
"201","0.385622000","10.0.0.1","10.0.0.3","TCP","66","distinct > 36471 [ACK] Seq=1 Ack=39121 Win=107520 Len=0 TSval=297307935 TSecr=297307888"
"202","0.399690000","10.0.0.3","10.0.0.1","TCP","2962","[TCP Retransmission] 36471 > distinct [ACK] Seq=39121 Ack=1 Win=29696 Len=2896 TSval=297307891 TSecr=297307884"
"203","0.409948000","10.0.0.1","10.0.0.3","TCP","66","distinct > 36471 [ACK] Seq=1 Ack=42017 Win=113152 Len=0 TSval=297307941 TSecr=297307891"
"204","0.423922000","10.0.0.3","10.0.0.1","TCP","2962","[TCP Retransmission] 36471 > distinct [ACK] Seq=42017 Ack=1 Win=29696 Len=2896 TSval=297307894 TSecr=297307887"
"205","0.434014000","10.0.0.1","10.0.0.3","TCP","66","distinct > 36471 [ACK] Seq=1 Ack=44913 Win=118784 Len=0 TSval=297307947 TSecr=297307894"
"206","0.448153000","10.0.0.3","10.0.0.1","TCP","2962","[TCP Retransmission] 36471 > distinct [ACK] Seq=44913 Ack=1 Win=29696 Len=2896 TSval=297307897 TSecr=297307890"
"207","0.458229000","10.0.0.1","10.0.0.3","TCP","66","distinct > 36471 [ACK] Seq=1 Ack=47809 Win=124928 Len=0 TSval=297307953 TSecr=297307897"
"208","0.472382000","10.0.0.3","10.0.0.1","TCP","2962","[TCP Retransmission] 36471 > distinct [ACK] Seq=47809 Ack=1 Win=29696 Len=2896 TSval=297307900 TSecr=297307893"
"209","0.483094000","10.0.0.1","10.0.0.3","TCP","66","distinct > 36471 [ACK] Seq=1 Ack=50705 Win=130560 Len=0 TSval=297307959 TSecr=297307900"
"210","0.496599000","10.0.0.3","10.0.0.1","TCP","2962","[TCP Retransmission] 36471 > distinct [ACK] Seq=50705 Ack=1 Win=29696 Len=2896 TSval=297307900 TSecr=297307893"
"211","0.506653000","10.0.0.1","10.0.0.3","TCP","66","distinct > 36471 [ACK] Seq=1 Ack=53601 Win=136192 Len=0 TSval=297307965 TSecr=297307900"
"212","0.520806000","10.0.0.3","10.0.0.1","TCP","2962","[TCP Retransmission] 36471 > distinct [ACK] Seq=53601 Ack=1 Win=29696 Len=2896 TSval=297307906 TSecr=297307899"
"213","0.389664000","10.0.0.3","10.0.0.1","TCP","2962","[TCP Retransmission] 36471 > distinct [ACK] Seq=39121 Ack=1 Win=29696 Len=2896 TSval=297307891 TSecr=297307884"
"214","0.395650000","10.0.0.1","10.0.0.3","TCP","66","distinct > 36471 [ACK] Seq=1 Ack=39121 Win=107520 Len=0 TSval=297307935 TSecr=297307888"
"215","0.413889000","10.0.0.3","10.0.0.1","TCP","2962","[TCP Retransmission] 36471 > distinct [ACK] Seq=42017 Ack=1 Win=29696 Len=2896 TSval=297307894 TSecr=297307887"
"216","0.419979000","10.0.0.1","10.0.0.3","TCP","66","distinct > 36471 [ACK] Seq=1 Ack=42017 Win=113152 Len=0 TSval=297307941 TSecr=297307891"
"217","0.438114000","10.0.0.3","10.0.0.1","TCP","2962","[TCP Retransmission] 36471 > distinct [ACK] Seq=44913 Ack=1 Win=29696 Len=2896 TSval=297307897 TSecr=297307890"
"218","0.444042000","10.0.0.1","10.0.0.3","TCP","66","distinct > 36471 [ACK] Seq=1 Ack=44913 Win=118784 Len=0 TSval=297307947 TSecr=297307894"
"219","0.462342000","10.0.0.3","10.0.0.1","TCP","2962","[TCP Retransmission] 36471 > distinct [ACK] Seq=47809 Ack=1 Win=29696 Len=2896 TSval=297307900 TSecr=297307893"
"220","0.468260000","10.0.0.1","10.0.0.3","TCP","66","distinct > 36471 [ACK] Seq=1 Ack=47809 Win=124928 Len=0 TSval=297307953 TSecr=297307897"
"221","0.486565000","10.0.0.3","10.0.0.1","TCP","2962","[TCP Retransmission] 36471 > distinct [ACK] Seq=50705 Ack=1 Win=29696 Len=2896 TSval=297307900 TSecr=297307893"
"222","0.493120000","10.0.0.1","10.0.0.3","TCP","66","distinct > 36471 [ACK] Seq=1 Ack=50705 Win=130560 Len=0 TSval=297307959 TSecr=297307900"
"223","0.510781000","10.0.0.3","10.0.0.1","TCP","2962","[TCP Retransmission] 36471 > distinct [ACK] Seq=53601 Ack=1 Win=29696 Len=2896 TSval=297307906 TSecr=297307899"
"224","0.516686000","10.0.0.1","10.0.0.3","TCP","66","distinct > 36471 [ACK] Seq=1 Ack=53601 Win=136192 Len=0 TSval=297307965 TSecr=297307900"
"225","0.535011000","10.0.0.3","10.0.0.1","TCP","2962","[TCP Retransmission] 36471 > distinct [ACK] Seq=56497 Ack=1 Win=29696 Len=2896 TSval=297307906 TSecr=297307899"
"226","0.540870000","10.0.0.1","10.0.0.3","TCP","66","distinct > 36471 [ACK] Seq=1 Ack=56497 Win=142336 Len=0 TSval=297307971 TSecr=297307906"
"227","0.559234000","10.0.0.3","10.0.0.1","TCP","2962","[TCP Retransmission] 36471 > distinct [PSH, ACK] Seq=59393 Ack=1 Win=29696 Len=2896 TSval=297307912 TSecr=297307905"
"228","0.565119000","10.0.0.1","10.0.0.3","TCP","66","distinct > 36471 [ACK] Seq=1 Ack=59393 Win=147968 Len=0 TSval=297307977 TSecr=297307906"
"229","0.583465000","10.0.0.3","10.0.0.1","TCP","2962","[TCP Retransmission] 36471 > distinct [ACK] Seq=62289 Ack=1 Win=29696 Len=2896 TSval=297307912 TSecr=297307905"
"230","0.589818000","10.0.0.1","10.0.0.3","TCP","66","distinct > 36471 [ACK] Seq=1 Ack=62289 Win=153600 Len=0 TSval=297307984 TSecr=297307912"
"231","0.607697000","10.0.0.3","10.0.0.1","TCP","2962","[TCP Retransmission] 36471 > distinct [ACK] Seq=65185 Ack=1 Win=29696 Len=2896 TSval=297307918 TSecr=297307911"
"232","0.613620000","10.0.0.1","10.0.0.3","TCP","66","distinct > 36471 [ACK] Seq=1 Ack=65185 Win=159744 Len=0 TSval=297307990 TSecr=297307912"
"233","0.631901000","10.0.0.3","10.0.0.1","TCP","2962","[TCP Retransmission] 36471 > distinct [ACK] Seq=68081 Ack=1 Win=29696 Len=2896 TSval=297307918 TSecr=297307911"
"234","0.438099000","10.0.0.3","10.0.0.1","TCP","2962","[TCP Retransmission] 36471 > distinct [ACK] Seq=44913 Ack=1 Win=29696 Len=2896 TSval=297307897 TSecr=297307890"
"235","0.444053000","10.0.0.1","10.0.0.3","TCP","66","distinct > 36471 [ACK] Seq=1 Ack=44913 Win=118784 Len=0 TSval=297307947 TSecr=297307894"
"236","0.462326000","10.0.0.3","10.0.0.1","TCP","2962","[TCP Retransmission] 36471 > distinct [ACK] Seq=47809 Ack=1 Win=29696 Len=2896 TSval=297307900 TSecr=297307893"
"237","0.468271000","10.0.0.1","10.0.0.3","TCP","66","distinct > 36471 [ACK] Seq=1 Ack=47809 Win=124928 Len=0 TSval=297307953 TSecr=297307897"
"238","0.486555000","10.0.0.3","10.0.0.1","TCP","2962","[TCP Retransmission] 36471 > distinct [ACK] Seq=50705 Ack=1 Win=29696 Len=2896 TSval=297307900 TSecr=297307893"
"239","0.493128000","10.0.0.1","10.0.0.3","TCP","66","distinct > 36471 [ACK] Seq=1 Ack=50705 Win=130560 Len=0 TSval=297307959 TSecr=297307900"
"240","0.510769000","10.0.0.3","10.0.0.1","TCP","2962","[TCP Retransmission] 36471 > distinct [ACK] Seq=53601 Ack=1 Win=29696 Len=2896 TSval=297307906 TSecr=297307899"
"241","0.516693000","10.0.0.1","10.0.0.3","TCP","66","distinct > 36471 [ACK] Seq=1 Ack=53601 Win=136192 Len=0 TSval=297307965 TSecr=297307900"
"242","0.534998000","10.0.0.3","10.0.0.1","TCP","2962","[TCP Retransmission] 36471 > distinct [ACK] Seq=56497 Ack=1 Win=29696 Len=2896 TSval=297307906 TSecr=297307899"
"243","0.540878000","10.0.0.1","10.0.0.3","TCP","66","distinct > 36471 [ACK] Seq=1 Ack=56497 Win=142336 Len=0 TSval=297307971 TSecr=297307906"
"244","0.559220000","10.0.0.3","10.0.0.1","TCP","2962","[TCP Retransmission] 36471 > distinct [PSH, ACK] Seq=59393 Ack=1 Win=29696 Len=2896 TSval=297307912 TSecr=297307905"
"245","0.565127000","10.0.0.1","10.0.0.3","TCP","66","distinct > 36471 [ACK] Seq=1 Ack=59393 Win=147968 Len=0 TSval=297307977 TSecr=297307906"
"246","0.583446000","10.0.0.3","10.0.0.1","TCP","2962","[TCP Retransmission] 36471 > distinct [ACK] Seq=62289 Ack=1 Win=29696 Len=2896 TSval=297307912 TSecr=297307905"
"247","0.589829000","10.0.0.1","10.0.0.3","TCP","66","distinct > 36471 [ACK] Seq=1 Ack=62289 Win=153600 Len=0 TSval=297307984 TSecr=297307912"
"248","0.607673000","10.0.0.3","10.0.0.1","TCP","2962","[TCP Retransmission] 36471 > distinct [ACK] Seq=65185 Ack=1 Win=29696 Len=2896 TSval=297307918 TSecr=297307911"
"249","0.613633000","10.0.0.1","10.0.0.3","TCP","66","distinct > 36471 [ACK] Seq=1 Ack=65185 Win=159744 Len=0 TSval=297307990 TSecr=297307912"
"250","0.631889000","10.0.0.3","10.0.0.1","TCP","2962","[TCP Retransmission] 36471 > distinct [ACK] Seq=68081 Ack=1 Win=29696 Len=2896 TSval=297307918 TSecr=297307911"
"251","0.637838000","10.0.0.1","10.0.0.3","TCP","66","distinct > 36471 [ACK] Seq=1 Ack=68081 Win=165376 Len=0 TSval=297307996 TSecr=297307918"
"252","0.656111000","10.0.0.3","10.0.0.1","TCP","2962","[TCP Retransmission] 36471 > distinct [ACK] Seq=70977 Ack=1 Win=29696 Len=2896 TSval=297307924 TSecr=297307917"
"253","0.662047000","10.0.0.1","10.0.0.3","TCP","66","distinct > 36471 [ACK] Seq=1 Ack=70977 Win=171008 Len=0 TSval=297308002 TSecr=297307918"
"254","0.478300000","10.0.0.1","10.0.0.3","TCP","66","distinct > 36471 [ACK] Seq=1 Ack=47809 Win=124928 Len=0 TSval=297307953 TSecr=297307897"
"255","0.488366000","10.0.0.3","10.0.0.1","TCP","2962","36471 > distinct [ACK] Seq=98383 Ack=1 Win=29696 Len=2896 TSval=297307961 TSecr=297307953"
"256","0.503157000","10.0.0.1","10.0.0.3","TCP","66","distinct > 36471 [ACK] Seq=1 Ack=50705 Win=130560 Len=0 TSval=297307959 TSecr=297307900"
"257","0.513196000","10.0.0.3","10.0.0.1","TCP","2962","36471 > distinct [ACK] Seq=101279 Ack=1 Win=29696 Len=2896 TSval=297307967 TSecr=297307959"
"258","0.526715000","10.0.0.1","10.0.0.3","TCP","66","distinct > 36471 [ACK] Seq=1 Ack=53601 Win=136192 Len=0 TSval=297307965 TSecr=297307900"
"259","0.536765000","10.0.0.3","10.0.0.1","TCP","2962","36471 > distinct [ACK] Seq=104175 Ack=1 Win=29696 Len=2896 TSval=297307973 TSecr=297307965"
"260","0.550901000","10.0.0.1","10.0.0.3","TCP","66","distinct > 36471 [ACK] Seq=1 Ack=56497 Win=142336 Len=0 TSval=297307971 TSecr=297307906"
"261","0.560938000","10.0.0.3","10.0.0.1","TCP","2962","36471 > distinct [ACK] Seq=107071 Ack=1 Win=29696 Len=2896 TSval=297307979 TSecr=297307971"
