"No.","Time","Source","Destination","Protocol","Length","Info"
"1","0.000000000","10.0.0.1","10.0.0.3","TCP","74","40753 > http [SYN] Seq=0 Win=29200 Len=0 MSS=1460 SACK_PERM=1 TSval=297770710 TSecr=0 WS=512"
"2","-0.003345000","10.0.0.1","10.0.0.3","TCP","74","[TCP Retransmission] 40753 > http [SYN] Seq=0 Win=29200 Len=0 MSS=1460 SACK_PERM=1 TSval=297770710 TSecr=0 WS=512"
"3","-0.003330000","10.0.0.1","10.0.0.3","TCP","74","[TCP Retransmission] 40753 > http [SYN] Seq=0 Win=29200 Len=0 MSS=1460 SACK_PERM=1 TSval=297770710 TSecr=0 WS=512"
"4","0.033651000","10.0.0.3","10.0.0.1","TCP","74","http > 40753 [SYN, ACK] Seq=0 Ack=1 Win=28960 Len=0 MSS=1460 SACK_PERM=1 TSval=297770719 TSecr=297770710 WS=512"
"5","0.069136000","10.0.0.1","10.0.0.3","TCP","66","40753 > http [ACK] Seq=1 Ack=1 Win=29696 Len=0 TSval=297770728 TSecr=297770719"
"6","0.071865000","10.0.0.1","10.0.0.3","HTTP","184","GET /mobydick.txt HTTP/1.1 "
"7","-0.003324000","10.0.0.1","10.0.0.3","TCP","74","[TCP Retransmission] 40753 > http [SYN] Seq=0 Win=29200 Len=0 MSS=1460 SACK_PERM=1 TSval=297770710 TSecr=0 WS=512"
"8","0.033640000","10.0.0.3","10.0.0.1","TCP","74","[TCP Retransmission] http > 40753 [SYN, ACK] Seq=0 Ack=1 Win=28960 Len=0 MSS=1460 SACK_PERM=1 TSval=297770719 TSecr=297770710 WS=512"
"9","0.069144000","10.0.0.1","10.0.0.3","TCP","66","40753 > http [ACK] Seq=1 Ack=1 Win=29696 Len=0 TSval=297770728 TSecr=297770719"
"10","0.071871000","10.0.0.1","10.0.0.3","HTTP","184","[TCP Retransmission] GET /mobydick.txt HTTP/1.1 "
"11","0.010028000","10.0.0.1","10.0.0.3","TCP","74","[TCP Retransmission] 40753 > http [SYN] Seq=0 Win=29200 Len=0 MSS=1460 SACK_PERM=1 TSval=297770710 TSecr=0 WS=512"
"12","0.020086000","10.0.0.3","10.0.0.1","TCP","74","[TCP Retransmission] http > 40753 [SYN, ACK] Seq=0 Ack=1 Win=28960 Len=0 MSS=1460 SACK_PERM=1 TSval=297770719 TSecr=297770710 WS=512"
"13","0.082107000","10.0.0.1","10.0.0.3","TCP","66","40753 > http [ACK] Seq=1 Ack=1 Win=29696 Len=0 TSval=297770728 TSecr=297770719"
"14","0.085691000","10.0.0.1","10.0.0.3","HTTP","184","[TCP Retransmission] GET /mobydick.txt HTTP/1.1 "
"15","0.095785000","10.0.0.3","10.0.0.1","TCP","66","http > 40753 [ACK] Seq=1 Ack=119 Win=29184 Len=0 TSval=297770738 TSecr=297770728"
"16","0.097005000","10.0.0.3","10.0.0.1","TCP","83","[TCP segment of a reassembled PDU]"
"17","0.097144000","10.0.0.3","10.0.0.1","TCP","2962","[TCP segment of a reassembled PDU]"
"18","0.097261000","10.0.0.3","10.0.0.1","TCP","2962","[TCP segment of a reassembled PDU]"
"19","0.097504000","10.0.0.3","10.0.0.1","TCP","1514","[TCP segment of a reassembled PDU]"
"20","0.097624000","10.0.0.3","10.0.0.1","TCP","2962","[TCP segment of a reassembled PDU]"
"21","0.097869000","10.0.0.3","10.0.0.1","TCP","2962","[TCP segment of a reassembled PDU]"
"22","0.147420000","10.0.0.1","10.0.0.3","TCP","66","40753 > http [ACK] Seq=119 Ack=18 Win=29696 Len=0 TSval=297770746 TSecr=297770738"
"23","0.147435000","10.0.0.1","10.0.0.3","TCP","66","40753 > http [ACK] Seq=119 Ack=2914 Win=35328 Len=0 TSval=297770746 TSecr=297770738"
"24","0.157469000","10.0.0.3","10.0.0.1","TCP","2962","[TCP segment of a reassembled PDU]"
"25","0.157584000","10.0.0.3","10.0.0.1","TCP","2962","[TCP segment of a reassembled PDU]"
"26","0.157827000","10.0.0.3","10.0.0.1","TCP","2962","[TCP segment of a reassembled PDU]"
"27","-0.014735000","10.0.0.1","10.0.0.3","TCP","74","[TCP Retransmission] 40753 > http [SYN] Seq=0 Win=29200 Len=0 MSS=1460 SACK_PERM=1 TSval=297770710 TSecr=0 WS=512"
"28","0.045766000","10.0.0.3","10.0.0.1","TCP","74","[TCP Retransmission] http > 40753 [SYN, ACK] Seq=0 Ack=1 Win=28960 Len=0 MSS=1460 SACK_PERM=1 TSval=297770719 TSecr=297770710 WS=512"
"29","0.055813000","10.0.0.1","10.0.0.3","TCP","66","40753 > http [ACK] Seq=1 Ack=1 Win=29696 Len=0 TSval=297770728 TSecr=297770719"
"30","0.055929000","10.0.0.1","10.0.0.3","HTTP","184","[TCP Retransmission] GET /mobydick.txt HTTP/1.1 "
"31","0.115980000","10.0.0.3","10.0.0.1","TCP","66","http > 40753 [ACK] Seq=1 Ack=119 Win=29184 Len=0 TSval=297770738 TSecr=297770728"
"32","0.117061000","10.0.0.3","10.0.0.1","TCP","83","[TCP Retransmission] http > 40753 [PSH, ACK] Seq=1 Ack=119 Win=29184 Len=17 TSval=297770738 TSecr=297770728"
"33","0.117178000","10.0.0.3","10.0.0.1","TCP","2962","[TCP Retransmission] [TCP segment of a reassembled PDU]"
"34","0.127106000","10.0.0.1","10.0.0.3","TCP","66","40753 > http [ACK] Seq=119 Ack=18 Win=29696 Len=0 TSval=297770746 TSecr=297770738"
"35","0.127196000","10.0.0.1","10.0.0.3","TCP","66","40753 > http [ACK] Seq=119 Ack=2914 Win=35328 Len=0 TSval=297770746 TSecr=297770738"
"36","0.139385000","10.0.0.3","10.0.0.1","TCP","2962","[TCP Retransmission] [TCP segment of a reassembled PDU]"
"37","0.149450000","10.0.0.1","10.0.0.3","TCP","66","40753 > http [ACK] Seq=119 Ack=5810 Win=40960 Len=0 TSval=297770751 TSecr=297770738"
"38","0.163602000","10.0.0.3","10.0.0.1","TCP","1514","[TCP Retransmission] [TCP segment of a reassembled PDU]"
"39","0.173666000","10.0.0.1","10.0.0.3","TCP","66","40753 > http [ACK] Seq=119 Ack=7258 Win=44032 Len=0 TSval=297770757 TSecr=297770738"
"40","0.175717000","10.0.0.3","10.0.0.1","TCP","2962","[TCP Retransmission] [TCP segment of a reassembled PDU]"
"41","0.185763000","10.0.0.1","10.0.0.3","TCP","66","40753 > http [ACK] Seq=119 Ack=10154 Win=49664 Len=0 TSval=297770760 TSecr=297770738"
"42","0.199928000","10.0.0.3","10.0.0.1","TCP","2962","[TCP Retransmission] [TCP segment of a reassembled PDU]"
"43","0.209987000","10.0.0.1","10.0.0.3","TCP","66","40753 > http [ACK] Seq=119 Ack=13050 Win=55296 Len=0 TSval=297770766 TSecr=297770738"
"44","-0.013346000","10.0.0.1","10.0.0.3","TCP","74","[TCP Retransmission] 40753 > http [SYN] Seq=0 Win=29200 Len=0 MSS=1460 SACK_PERM=1 TSval=297770710 TSecr=0 WS=512"
"45","0.010006000","10.0.0.1","10.0.0.3","TCP","74","[TCP Retransmission] 40753 > http [SYN] Seq=0 Win=29200 Len=0 MSS=1460 SACK_PERM=1 TSval=297770710 TSecr=0 WS=512"
"46","0.105902000","10.0.0.3","10.0.0.1","TCP","66","http > 40753 [ACK] Seq=1 Ack=119 Win=29184 Len=0 TSval=297770738 TSecr=297770728"
"47","0.107038000","10.0.0.3","10.0.0.1","TCP","83","[TCP Retransmission] http > 40753 [PSH, ACK] Seq=1 Ack=119 Win=29184 Len=17 TSval=297770738 TSecr=297770728"
"48","0.107162000","10.0.0.3","10.0.0.1","TCP","2962","[TCP Retransmission] [TCP segment of a reassembled PDU]"
"49","0.129342000","10.0.0.3","10.0.0.1","TCP","2962","[TCP Retransmission] [TCP segment of a reassembled PDU]"
"50","0.137314000","10.0.0.1","10.0.0.3","TCP","66","40753 > http [ACK] Seq=119 Ack=18 Win=29696 Len=0 TSval=297770746 TSecr=297770738"
"51","0.137328000","10.0.0.1","10.0.0.3","TCP","66","40753 > http [ACK] Seq=119 Ack=2914 Win=35328 Len=0 TSval=297770746 TSecr=297770738"
"52","0.153567000","10.0.0.3","10.0.0.1","TCP","1514","[TCP Retransmission] [TCP segment of a reassembled PDU]"
"53","0.159485000","10.0.0.1","10.0.0.3","TCP","66","40753 > http [ACK] Seq=119 Ack=5810 Win=40960 Len=0 TSval=297770751 TSecr=297770738"
"54","0.165684000","10.0.0.3","10.0.0.1","TCP","2962","[TCP Retransmission] [TCP segment of a reassembled PDU]"
"55","0.183710000","10.0.0.1","10.0.0.3","TCP","66","40753 > http [ACK] Seq=119 Ack=7258 Win=44032 Len=0 TSval=297770757 TSecr=297770738"
"56","0.189897000","10.0.0.3","10.0.0.1","TCP","2962","[TCP Retransmission] [TCP segment of a reassembled PDU]"
"57","0.195792000","10.0.0.1","10.0.0.3","TCP","66","40753 > http [ACK] Seq=119 Ack=10154 Win=49664 Len=0 TSval=297770760 TSecr=297770738"
"58","0.220030000","10.0.0.1","10.0.0.3","TCP","66","40753 > http [ACK] Seq=119 Ack=13050 Win=55296 Len=0 TSval=297770766 TSecr=297770738"
"59","0.238129000","10.0.0.3","10.0.0.1","TCP","2962","[TCP Retransmission] [TCP segment of a reassembled PDU]"
"60","0.262362000","10.0.0.3","10.0.0.1","TCP","2962","[TCP Retransmission] [TCP segment of a reassembled PDU]"
"61","0.268618000","10.0.0.1","10.0.0.3","TCP","66","40753 > http [ACK] Seq=119 Ack=15946 Win=61440 Len=0 TSval=297770779 TSecr=297770753"
"62","0.286576000","10.0.0.3","10.0.0.1","TCP","2962","[TCP Retransmission] [TCP segment of a reassembled PDU]"
"63","0.292472000","10.0.0.1","10.0.0.3","TCP","66","40753 > http [ACK] Seq=119 Ack=18842 Win=67072 Len=0 TSval=297770785 TSecr=297770753"
"64","0.316665000","10.0.0.1","10.0.0.3","TCP","66","40753 > http [ACK] Seq=119 Ack=21738 Win=72704 Len=0 TSval=297770791 TSecr=297770753"
"65","0.322808000","10.0.0.3","10.0.0.1","TCP","2962","[TCP segment of a reassembled PDU]"
"66","0.105895000","10.0.0.3","10.0.0.1","TCP","66","http > 40753 [ACK] Seq=1 Ack=119 Win=29184 Len=0 TSval=297770738 TSecr=297770728"
"67","0.107028000","10.0.0.3","10.0.0.1","TCP","83","[TCP Retransmission] http > 40753 [PSH, ACK] Seq=1 Ack=119 Win=29184 Len=17 TSval=297770738 TSecr=297770728"
"68","0.107157000","10.0.0.3","10.0.0.1","TCP","2962","[TCP Retransmission] [TCP segment of a reassembled PDU]"
"69","0.129330000","10.0.0.3","10.0.0.1","TCP","2962","[TCP Retransmission] [TCP segment of a reassembled PDU]"
"70","0.137325000","10.0.0.1","10.0.0.3","TCP","66","40753 > http [ACK] Seq=119 Ack=18 Win=29696 Len=0 TSval=297770746 TSecr=297770738"
"71","0.137330000","10.0.0.1","10.0.0.3","TCP","66","40753 > http [ACK] Seq=119 Ack=2914 Win=35328 Len=0 TSval=297770746 TSecr=297770738"
"72","0.153555000","10.0.0.3","10.0.0.1","TCP","1514","[TCP Retransmission] [TCP segment of a reassembled PDU]"
"73","0.159495000","10.0.0.1","10.0.0.3","TCP","66","40753 > http [ACK] Seq=119 Ack=5810 Win=40960 Len=0 TSval=297770751 TSecr=297770738"
"74","0.165670000","10.0.0.3","10.0.0.1","TCP","2962","[TCP Retransmission] [TCP segment of a reassembled PDU]"
"75","0.183725000","10.0.0.1","10.0.0.3","TCP","66","40753 > http [ACK] Seq=119 Ack=7258 Win=44032 Len=0 TSval=297770757 TSecr=297770738"
"76","0.189887000","10.0.0.3","10.0.0.1","TCP","2962","[TCP Retransmission] [TCP segment of a reassembled PDU]"
"77","0.195809000","10.0.0.1","10.0.0.3","TCP","66","40753 > http [ACK] Seq=119 Ack=10154 Win=49664 Len=0 TSval=297770760 TSecr=297770738"
"78","0.220048000","10.0.0.1","10.0.0.3","TCP","66","40753 > http [ACK] Seq=119 Ack=13050 Win=55296 Len=0 TSval=297770766 TSecr=297770738"
"79","0.238116000","10.0.0.3","10.0.0.1","TCP","2962","[TCP Retransmission] [TCP segment of a reassembled PDU]"
"80","0.262343000","10.0.0.3","10.0.0.1","TCP","2962","[TCP Retransmission] [TCP segment of a reassembled PDU]"
"81","0.268633000","10.0.0.1","10.0.0.3","TCP","66","40753 > http [ACK] Seq=119 Ack=15946 Win=61440 Len=0 TSval=297770779 TSecr=297770753"
"82","0.286563000","10.0.0.3","10.0.0.1","TCP","2962","[TCP Retransmission] [TCP segment of a reassembled PDU]"
"83","0.292480000","10.0.0.1","10.0.0.3","TCP","66","40753 > http [ACK] Seq=119 Ack=18842 Win=67072 Len=0 TSval=297770785 TSecr=297770753"
"84","0.316676000","10.0.0.1","10.0.0.3","TCP","66","40753 > http [ACK] Seq=119 Ack=21738 Win=72704 Len=0 TSval=297770791 TSecr=297770753"
"85","0.322790000","10.0.0.3","10.0.0.1","TCP","2962","[TCP Retransmission] [TCP segment of a reassembled PDU]"
"86","0.347014000","10.0.0.3","10.0.0.1","TCP","2962","[TCP segment of a reassembled PDU]"
"87","0.169522000","10.0.0.1","10.0.0.3","TCP","66","40753 > http [ACK] Seq=119 Ack=5810 Win=40960 Len=0 TSval=297770751 TSecr=297770738"
"88","0.179583000","10.0.0.3","10.0.0.1","TCP","2962","[TCP Retransmission] [TCP segment of a reassembled PDU]"
"89","0.179694000","10.0.0.3","10.0.0.1","TCP","2962","[TCP Retransmission] [TCP segment of a reassembled PDU]"
"90","0.193759000","10.0.0.1","10.0.0.3","TCP","66","40753 > http [ACK] Seq=119 Ack=7258 Win=44032 Len=0 TSval=297770757 TSecr=297770738"
"91","0.203819000","10.0.0.3","10.0.0.1","TCP","2962","[TCP segment of a reassembled PDU]"
"92","0.205856000","10.0.0.1","10.0.0.3","TCP","66","40753 > http [ACK] Seq=119 Ack=10154 Win=49664 Len=0 TSval=297770760 TSecr=297770738"
"93","0.215909000","10.0.0.3","10.0.0.1","TCP","2962","[TCP segment of a reassembled PDU]"
"94","0.216018000","10.0.0.3","10.0.0.1","TCP","2962","[TCP segment of a reassembled PDU]"
"95","0.230078000","10.0.0.1","10.0.0.3","TCP","66","40753 > http [ACK] Seq=119 Ack=13050 Win=55296 Len=0 TSval=297770766 TSecr=297770738"
"96","0.240138000","10.0.0.3","10.0.0.1","TCP","2962","[TCP segment of a reassembled PDU]"
"97","0.240250000","10.0.0.3","10.0.0.1","TCP","2962","[TCP segment of a reassembled PDU]"
"98","0.278660000","10.0.0.1","10.0.0.3","TCP","66","40753 > http [ACK] Seq=119 Ack=15946 Win=61440 Len=0 TSval=297770779 TSecr=297770753"
"99","0.288724000","10.0.0.3","10.0.0.1","TCP","2962","[TCP segment of a reassembled PDU]"
"100","0.288833000","10.0.0.3","10.0.0.1","TCP","2962","[TCP segment of a reassembled PDU]"
"101","0.302504000","10.0.0.1","10.0.0.3","TCP","66","40753 > http [ACK] Seq=119 Ack=18842 Win=67072 Len=0 TSval=297770785 TSecr=297770753"
"102","0.312559000","10.0.0.3","10.0.0.1","TCP","2962","[TCP segment of a reassembled PDU]"
"103","0.312670000","10.0.0.3","10.0.0.1","TCP","2962","[TCP segment of a reassembled PDU]"
"104","0.326706000","10.0.0.1","10.0.0.3","TCP","66","40753 > http [ACK] Seq=119 Ack=21738 Win=72704 Len=0 TSval=297770791 TSecr=297770753"
"105","0.336752000","10.0.0.3","10.0.0.1","TCP","2962","[TCP segment of a reassembled PDU]"
"106","0.336867000","10.0.0.3","10.0.0.1","TCP","2962","[TCP segment of a reassembled PDU]"
"107","0.362956000","10.0.0.1","10.0.0.3","TCP","66","40753 > http [ACK] Seq=119 Ack=24634 Win=78848 Len=0 TSval=297770800 TSecr=297770759"
"108","0.373016000","10.0.0.3","10.0.0.1","TCP","2962","[TCP segment of a reassembled PDU]"
"109","0.373129000","10.0.0.3","10.0.0.1","TCP","2962","[TCP segment of a reassembled PDU]"
"110","0.387201000","10.0.0.1","10.0.0.3","TCP","66","40753 > http [ACK] Seq=119 Ack=27530 Win=84480 Len=0 TSval=297770806 TSecr=297770759"
"111","0.397269000","10.0.0.3","10.0.0.1","TCP","2962","[TCP segment of a reassembled PDU]"
"112","0.397377000","10.0.0.3","10.0.0.1","TCP","2962","[TCP segment of a reassembled PDU]"
"113","0.248157000","10.0.0.3","10.0.0.1","TCP","2962","[TCP Retransmission] [TCP segment of a reassembled PDU]"
"114","0.258214000","10.0.0.1","10.0.0.3","TCP","66","40753 > http [ACK] Seq=119 Ack=15946 Win=61440 Len=0 TSval=297770779 TSecr=297770753"
"115","0.272394000","10.0.0.3","10.0.0.1","TCP","2962","[TCP Retransmission] [TCP segment of a reassembled PDU]"
"116","0.282442000","10.0.0.1","10.0.0.3","TCP","66","40753 > http [ACK] Seq=119 Ack=18842 Win=67072 Len=0 TSval=297770785 TSecr=297770753"
"117","0.296609000","10.0.0.3","10.0.0.1","TCP","2962","[TCP Retransmission] [TCP segment of a reassembled PDU]"
"118","0.306643000","10.0.0.1","10.0.0.3","TCP","66","40753 > http [ACK] Seq=119 Ack=21738 Win=72704 Len=0 TSval=297770791 TSecr=297770753"
"119","0.332839000","10.0.0.3","10.0.0.1","TCP","2962","[TCP Retransmission] [TCP segment of a reassembled PDU]"
"120","0.342889000","10.0.0.1","10.0.0.3","TCP","66","40753 > http [ACK] Seq=119 Ack=24634 Win=78848 Len=0 TSval=297770800 TSecr=297770759"
"121","0.357065000","10.0.0.3","10.0.0.1","TCP","2962","[TCP Retransmission] [TCP segment of a reassembled PDU]"
"122","0.367111000","10.0.0.1","10.0.0.3","TCP","66","40753 > http [ACK] Seq=119 Ack=27530 Win=84480 Len=0 TSval=297770806 TSecr=297770759"
"123","0.393278000","10.0.0.3","10.0.0.1","TCP","2962","[TCP Retransmission] [TCP segment of a reassembled PDU]"
"124","0.403335000","10.0.0.1","10.0.0.3","TCP","66","40753 > http [ACK] Seq=119 Ack=30426 Win=90112 Len=0 TSval=297770815 TSecr=297770765"
"125","0.429507000","10.0.0.3","10.0.0.1","TCP","2962","[TCP Retransmission] [TCP segment of a reassembled PDU]"
"126","0.439568000","10.0.0.1","10.0.0.3","TCP","66","40753 > http [ACK] Seq=119 Ack=33322 Win=96256 Len=0 TSval=297770824 TSecr=297770768"
"127","0.453747000","10.0.0.3","10.0.0.1","TCP","2962","[TCP Retransmission] [TCP segment of a reassembled PDU]"
"128","0.463783000","10.0.0.1","10.0.0.3","TCP","66","40753 > http [ACK] Seq=119 Ack=36218 Win=101888 Len=0 TSval=297770830 TSecr=297770768"
"129","0.347031000","10.0.0.3","10.0.0.1","TCP","2962","[TCP Retransmission] [TCP segment of a reassembled PDU]"
"130","0.352919000","10.0.0.1","10.0.0.3","TCP","66","40753 > http [ACK] Seq=119 Ack=24634 Win=78848 Len=0 TSval=297770800 TSecr=297770759"
"131","0.377143000","10.0.0.1","10.0.0.3","TCP","66","40753 > http [ACK] Seq=119 Ack=27530 Win=84480 Len=0 TSval=297770806 TSecr=297770759"
"132","0.383244000","10.0.0.3","10.0.0.1","TCP","2962","[TCP Retransmission] [TCP segment of a reassembled PDU]"
"133","0.413372000","10.0.0.1","10.0.0.3","TCP","66","40753 > http [ACK] Seq=119 Ack=30426 Win=90112 Len=0 TSval=297770815 TSecr=297770765"
"134","0.419477000","10.0.0.3","10.0.0.1","TCP","2962","[TCP Retransmission] [TCP segment of a reassembled PDU]"
"135","0.443712000","10.0.0.3","10.0.0.1","TCP","2962","[TCP Retransmission] [TCP segment of a reassembled PDU]"
"136","0.449605000","10.0.0.1","10.0.0.3","TCP","66","40753 > http [ACK] Seq=119 Ack=33322 Win=96256 Len=0 TSval=297770824 TSecr=297770768"
"137","0.473805000","10.0.0.1","10.0.0.3","TCP","66","40753 > http [ACK] Seq=119 Ack=36218 Win=101888 Len=0 TSval=297770830 TSecr=297770768"
"138","0.480635000","10.0.0.3","10.0.0.1","TCP","2962","[TCP Retransmission] [TCP segment of a reassembled PDU]"
"139","0.504863000","10.0.0.3","10.0.0.1","TCP","2962","[TCP Retransmission] [TCP segment of a reassembled PDU]"
"140","0.510730000","10.0.0.1","10.0.0.3","TCP","66","40753 > http [ACK] Seq=119 Ack=39114 Win=107520 Len=0 TSval=297770839 TSecr=297770774"
"141","0.534953000","10.0.0.1","10.0.0.3","TCP","66","40753 > http [ACK] Seq=119 Ack=42010 Win=113664 Len=0 TSval=297770845 TSecr=297770774"
"142","0.553092000","10.0.0.3","10.0.0.1","TCP","2962","[TCP Retransmission] [TCP segment of a reassembled PDU]"
"143","0.352929000","10.0.0.1","10.0.0.3","TCP","66","40753 > http [ACK] Seq=119 Ack=24634 Win=78848 Len=0 TSval=297770800 TSecr=297770759"
"144","0.377162000","10.0.0.1","10.0.0.3","TCP","66","40753 > http [ACK] Seq=119 Ack=27530 Win=84480 Len=0 TSval=297770806 TSecr=297770759"
"145","0.383232000","10.0.0.3","10.0.0.1","TCP","2962","[TCP Retransmission] [TCP segment of a reassembled PDU]"
"146","0.413388000","10.0.0.1","10.0.0.3","TCP","66","40753 > http [ACK] Seq=119 Ack=30426 Win=90112 Len=0 TSval=297770815 TSecr=297770765"
"147","0.419462000","10.0.0.3","10.0.0.1","TCP","2962","[TCP Retransmission] [TCP segment of a reassembled PDU]"
"148","0.443687000","10.0.0.3","10.0.0.1","TCP","2962","[TCP Retransmission] [TCP segment of a reassembled PDU]"
"149","0.449622000","10.0.0.1","10.0.0.3","TCP","66","40753 > http [ACK] Seq=119 Ack=33322 Win=96256 Len=0 TSval=297770824 TSecr=297770768"
"150","0.473814000","10.0.0.1","10.0.0.3","TCP","66","40753 > http [ACK] Seq=119 Ack=36218 Win=101888 Len=0 TSval=297770830 TSecr=297770768"
"151","0.480624000","10.0.0.3","10.0.0.1","TCP","2962","[TCP Retransmission] [TCP segment of a reassembled PDU]"
"152","0.504850000","10.0.0.3","10.0.0.1","TCP","2962","[TCP Retransmission] [TCP segment of a reassembled PDU]"
"153","0.510743000","10.0.0.1","10.0.0.3","TCP","66","40753 > http [ACK] Seq=119 Ack=39114 Win=107520 Len=0 TSval=297770839 TSecr=297770774"
"154","0.534961000","10.0.0.1","10.0.0.3","TCP","66","40753 > http [ACK] Seq=119 Ack=42010 Win=113664 Len=0 TSval=297770845 TSecr=297770774"
"155","0.553079000","10.0.0.3","10.0.0.1","TCP","2962","[TCP Retransmission] [TCP segment of a reassembled PDU]"
"156","0.577301000","10.0.0.3","10.0.0.1","TCP","2962","[TCP Retransmission] [TCP segment of a reassembled PDU]"
"157","0.583196000","10.0.0.1","10.0.0.3","TCP","66","40753 > http [ACK] Seq=119 Ack=44906 Win=119296 Len=0 TSval=297770857 TSecr=297770786"
"158","0.423421000","10.0.0.1","10.0.0.3","TCP","66","40753 > http [ACK] Seq=119 Ack=30426 Win=90112 Len=0 TSval=297770815 TSecr=297770765"
"159","0.433489000","10.0.0.3","10.0.0.1","TCP","2962","[TCP segment of a reassembled PDU]"
"160","0.433598000","10.0.0.3","10.0.0.1","TCP","2962","[TCP segment of a reassembled PDU]"
"161","0.459651000","10.0.0.1","10.0.0.3","TCP","66","40753 > http [ACK] Seq=119 Ack=33322 Win=96256 Len=0 TSval=297770824 TSecr=297770768"
"162","0.469692000","10.0.0.3","10.0.0.1","TCP","2962","[TCP segment of a reassembled PDU]"
"163","0.469804000","10.0.0.3","10.0.0.1","TCP","2962","[TCP segment of a reassembled PDU]"
"164","0.483840000","10.0.0.1","10.0.0.3","TCP","66","40753 > http [ACK] Seq=119 Ack=36218 Win=101888 Len=0 TSval=297770830 TSecr=297770768"
"165","0.493877000","10.0.0.3","10.0.0.1","TCP","2962","[TCP segment of a reassembled PDU]"
"166","0.493989000","10.0.0.3","10.0.0.1","TCP","2962","[TCP segment of a reassembled PDU]"
"167","0.520771000","10.0.0.1","10.0.0.3","TCP","66","40753 > http [ACK] Seq=119 Ack=39114 Win=107520 Len=0 TSval=297770839 TSecr=297770774"
"168","0.530807000","10.0.0.3","10.0.0.1","TCP","2962","[TCP segment of a reassembled PDU]"
"169","0.530922000","10.0.0.3","10.0.0.1","TCP","2962","[TCP segment of a reassembled PDU]"
"170","0.544983000","10.0.0.1","10.0.0.3","TCP","66","40753 > http [ACK] Seq=119 Ack=42010 Win=113664 Len=0 TSval=297770845 TSecr=297770774"
"171","0.555016000","10.0.0.3","10.0.0.1","TCP","2962","[TCP segment of a reassembled PDU]"
"172","0.593214000","10.0.0.1","10.0.0.3","TCP","66","40753 > http [ACK] Seq=119 Ack=44906 Win=119296 Len=0 TSval=297770857 TSecr=297770786"
"173","0.603251000","10.0.0.3","10.0.0.1","TCP","2962","[TCP segment of a reassembled PDU]"
"174","0.617461000","10.0.0.1","10.0.0.3","TCP","66","40753 > http [ACK] Seq=119 Ack=47802 Win=124928 Len=0 TSval=297770863 TSecr=297770786"
"175","0.627498000","10.0.0.3","10.0.0.1","TCP","2962","[TCP segment of a reassembled PDU]"
"176","0.656411000","10.0.0.1","10.0.0.3","TCP","66","40753 > http [ACK] Seq=119 Ack=50698 Win=130560 Len=0 TSval=297770873 TSecr=297770792"
"177","0.666481000","10.0.0.3","10.0.0.1","TCP","2962","[TCP segment of a reassembled PDU]"
"178","0.490663000","10.0.0.3","10.0.0.1","TCP","2962","[TCP Retransmission] [TCP segment of a reassembled PDU]"
"179","0.500692000","10.0.0.1","10.0.0.3","TCP","66","40753 > http [ACK] Seq=119 Ack=39114 Win=107520 Len=0 TSval=297770839 TSecr=297770774"
"180","0.514894000","10.0.0.3","10.0.0.1","TCP","2962","[TCP Retransmission] [TCP segment of a reassembled PDU]"
"181","0.524927000","10.0.0.1","10.0.0.3","TCP","66","40753 > http [ACK] Seq=119 Ack=42010 Win=113664 Len=0 TSval=297770845 TSecr=297770774"
"182","0.563120000","10.0.0.3","10.0.0.1","TCP","2962","[TCP Retransmission] [TCP segment of a reassembled PDU]"
"183","0.573158000","10.0.0.1","10.0.0.3","TCP","66","40753 > http [ACK] Seq=119 Ack=44906 Win=119296 Len=0 TSval=297770857 TSecr=297770786"
"184","0.587355000","10.0.0.3","10.0.0.1","TCP","2962","[TCP Retransmission] [TCP segment of a reassembled PDU]"
"185","0.597400000","10.0.0.1","10.0.0.3","TCP","66","40753 > http [ACK] Seq=119 Ack=47802 Win=124928 Len=0 TSval=297770863 TSecr=297770786"
"186","0.626311000","10.0.0.3","10.0.0.1","TCP","2962","[TCP Retransmission] [TCP segment of a reassembled PDU]"
"187","0.636343000","10.0.0.1","10.0.0.3","TCP","66","40753 > http [ACK] Seq=119 Ack=50698 Win=130560 Len=0 TSval=297770873 TSecr=297770792"
"188","0.650519000","10.0.0.3","10.0.0.1","TCP","2962","[TCP Retransmission] [TCP segment of a reassembled PDU]"
"189","0.660574000","10.0.0.1","10.0.0.3","TCP","66","40753 > http [ACK] Seq=119 Ack=53594 Win=136704 Len=0 TSval=297770879 TSecr=297770792"
"190","0.686754000","10.0.0.3","10.0.0.1","TCP","2962","[TCP Retransmission] [TCP segment of a reassembled PDU]"
"191","0.696788000","10.0.0.1","10.0.0.3","TCP","66","40753 > http [ACK] Seq=119 Ack=56490 Win=142336 Len=0 TSval=297770888 TSecr=297770798"
"192","0.710980000","10.0.0.3","10.0.0.1","TCP","2962","[TCP Retransmission] [TCP segment of a reassembled PDU]"
"193","0.721009000","10.0.0.1","10.0.0.3","TCP","66","40753 > http [ACK] Seq=119 Ack=59386 Win=147968 Len=0 TSval=297770894 TSecr=297770798"
"194","0.577320000","10.0.0.3","10.0.0.1","TCP","2962","[TCP Retransmission] [TCP segment of a reassembled PDU]"
"195","0.583185000","10.0.0.1","10.0.0.3","TCP","66","40753 > http [ACK] Seq=119 Ack=44906 Win=119296 Len=0 TSval=297770857 TSecr=297770786"
"196","0.607433000","10.0.0.1","10.0.0.3","TCP","66","40753 > http [ACK] Seq=119 Ack=47802 Win=124928 Len=0 TSval=297770863 TSecr=297770786"
"197","0.616273000","10.0.0.3","10.0.0.1","TCP","2962","[TCP Retransmission] [TCP segment of a reassembled PDU]"
"198","0.640490000","10.0.0.3","10.0.0.1","TCP","2962","[TCP Retransmission] [TCP segment of a reassembled PDU]"
"199","0.646371000","10.0.0.1","10.0.0.3","TCP","66","40753 > http [ACK] Seq=119 Ack=50698 Win=130560 Len=0 TSval=297770873 TSecr=297770792"
"200","0.670607000","10.0.0.1","10.0.0.3","TCP","66","40753 > http [ACK] Seq=119 Ack=53594 Win=136704 Len=0 TSval=297770879 TSecr=297770792"
"201","0.676723000","10.0.0.3","10.0.0.1","TCP","2962","[TCP Retransmission] [TCP segment of a reassembled PDU]"
"202","0.700945000","10.0.0.3","10.0.0.1","TCP","2962","[TCP Retransmission] [TCP segment of a reassembled PDU]"
"203","0.706814000","10.0.0.1","10.0.0.3","TCP","66","40753 > http [ACK] Seq=119 Ack=56490 Win=142336 Len=0 TSval=297770888 TSecr=297770798"
"204","0.731030000","10.0.0.1","10.0.0.3","TCP","66","40753 > http [ACK] Seq=119 Ack=59386 Win=147968 Len=0 TSval=297770894 TSecr=297770798"
"205","0.737166000","10.0.0.3","10.0.0.1","TCP","2962","[TCP Retransmission] [TCP segment of a reassembled PDU]"
"206","0.761387000","10.0.0.3","10.0.0.1","TCP","2962","[TCP Retransmission] [TCP segment of a reassembled PDU]"
"207","0.767256000","10.0.0.1","10.0.0.3","TCP","66","40753 > http [ACK] Seq=119 Ack=62282 Win=154112 Len=0 TSval=297770903 TSecr=297770807"
"208","0.791481000","10.0.0.1","10.0.0.3","TCP","66","40753 > http [ACK] Seq=119 Ack=65178 Win=159744 Len=0 TSval=297770909 TSecr=297770807"
"209","0.797616000","10.0.0.3","10.0.0.1","TCP","2962","[TCP Retransmission] [TCP segment of a reassembled PDU]"
"210","0.821841000","10.0.0.3","10.0.0.1","TCP","2962","[TCP Retransmission] [TCP segment of a reassembled PDU]"
"211","0.827708000","10.0.0.1","10.0.0.3","TCP","66","40753 > http [ACK] Seq=119 Ack=68074 Win=165376 Len=0 TSval=297770918 TSecr=297770813"
"212","0.607443000","10.0.0.1","10.0.0.3","TCP","66","40753 > http [ACK] Seq=119 Ack=47802 Win=124928 Len=0 TSval=297770863 TSecr=297770786"
"213","0.616262000","10.0.0.3","10.0.0.1","TCP","2962","[TCP Retransmission] [TCP segment of a reassembled PDU]"
"214","0.640481000","10.0.0.3","10.0.0.1","TCP","2962","[TCP Retransmission] [TCP segment of a reassembled PDU]"
"215","0.646381000","10.0.0.1","10.0.0.3","TCP","66","40753 > http [ACK] Seq=119 Ack=50698 Win=130560 Len=0 TSval=297770873 TSecr=297770792"
"216","0.670623000","10.0.0.1","10.0.0.3","TCP","66","40753 > http [ACK] Seq=119 Ack=53594 Win=136704 Len=0 TSval=297770879 TSecr=297770792"
"217","0.676707000","10.0.0.3","10.0.0.1","TCP","2962","[TCP Retransmission] [TCP segment of a reassembled PDU]"
"218","0.700931000","10.0.0.3","10.0.0.1","TCP","2962","[TCP Retransmission] [TCP segment of a reassembled PDU]"
"219","0.706829000","10.0.0.1","10.0.0.3","TCP","66","40753 > http [ACK] Seq=119 Ack=56490 Win=142336 Len=0 TSval=297770888 TSecr=297770798"
"220","0.731039000","10.0.0.1","10.0.0.3","TCP","66","40753 > http [ACK] Seq=119 Ack=59386 Win=147968 Len=0 TSval=297770894 TSecr=297770798"
"221","0.737153000","10.0.0.3","10.0.0.1","TCP","2962","[TCP Retransmission] [TCP segment of a reassembled PDU]"
"222","0.761376000","10.0.0.3","10.0.0.1","TCP","2962","[TCP Retransmission] [TCP segment of a reassembled PDU]"
"223","0.767265000","10.0.0.1","10.0.0.3","TCP","66","40753 > http [ACK] Seq=119 Ack=62282 Win=154112 Len=0 TSval=297770903 TSecr=297770807"
"224","0.791489000","10.0.0.1","10.0.0.3","TCP","66","40753 > http [ACK] Seq=119 Ack=65178 Win=159744 Len=0 TSval=297770909 TSecr=297770807"
"225","0.797603000","10.0.0.3","10.0.0.1","TCP","2962","[TCP Retransmission] [TCP segment of a reassembled PDU]"
"226","0.821827000","10.0.0.3","10.0.0.1","TCP","2962","[TCP Retransmission] [TCP segment of a reassembled PDU]"
"227","0.827719000","10.0.0.1","10.0.0.3","TCP","66","40753 > http [ACK] Seq=119 Ack=68074 Win=165376 Len=0 TSval=297770918 TSecr=297770813"
"228","0.851942000","10.0.0.1","10.0.0.3","TCP","66","40753 > http [ACK] Seq=119 Ack=70970 Win=171520 Len=0 TSval=297770924 TSecr=297770813"
"229","0.680648000","10.0.0.1","10.0.0.3","TCP","66","40753 > http [ACK] Seq=119 Ack=53594 Win=136704 Len=0 TSval=297770879 TSecr=297770792"
"230","0.690684000","10.0.0.3","10.0.0.1","TCP","2962","[TCP segment of a reassembled PDU]"
"231","0.716860000","10.0.0.1","10.0.0.3","TCP","66","40753 > http [ACK] Seq=119 Ack=56490 Win=142336 Len=0 TSval=297770888 TSecr=297770798"
"232","0.726918000","10.0.0.3","10.0.0.1","TCP","2962","[TCP segment of a reassembled PDU]"
"233","0.741058000","10.0.0.1","10.0.0.3","TCP","66","40753 > http [ACK] Seq=119 Ack=59386 Win=147968 Len=0 TSval=297770894 TSecr=297770798"
"234","0.751097000","10.0.0.3","10.0.0.1","TCP","2962","[TCP segment of a reassembled PDU]"
"235","0.777286000","10.0.0.1","10.0.0.3","TCP","66","40753 > http [ACK] Seq=119 Ack=62282 Win=154112 Len=0 TSval=297770903 TSecr=297770807"
"236","0.787324000","10.0.0.3","10.0.0.1","TCP","2962","[TCP segment of a reassembled PDU]"
"237","0.801511000","10.0.0.1","10.0.0.3","TCP","66","40753 > http [ACK] Seq=119 Ack=65178 Win=159744 Len=0 TSval=297770909 TSecr=297770807"
"238","0.811555000","10.0.0.3","10.0.0.1","TCP","2962","[TCP segment of a reassembled PDU]"
"239","0.837746000","10.0.0.1","10.0.0.3","TCP","66","40753 > http [ACK] Seq=119 Ack=68074 Win=165376 Len=0 TSval=297770918 TSecr=297770813"
"240","0.847799000","10.0.0.3","10.0.0.1","TCP","2962","[TCP segment of a reassembled PDU]"
"241","0.861962000","10.0.0.1","10.0.0.3","TCP","66","40753 > http [ACK] Seq=119 Ack=70970 Win=171520 Len=0 TSval=297770924 TSecr=297770813"
"242","0.872004000","10.0.0.3","10.0.0.1","TCP","2962","[TCP segment of a reassembled PDU]"
"243","0.910226000","10.0.0.1","10.0.0.3","TCP","66","40753 > http [ACK] Seq=119 Ack=73866 Win=177152 Len=0 TSval=297770936 TSecr=297770822"
"244","0.747195000","10.0.0.3","10.0.0.1","TCP","2962","[TCP Retransmission] [TCP segment of a reassembled PDU]"
"245","0.757228000","10.0.0.1","10.0.0.3","TCP","66","40753 > http [ACK] Seq=119 Ack=62282 Win=154112 Len=0 TSval=297770903 TSecr=297770807"
"246","0.771412000","10.0.0.3","10.0.0.1","TCP","2962","[TCP Retransmission] [TCP segment of a reassembled PDU]"
"247","0.781450000","10.0.0.1","10.0.0.3","TCP","66","40753 > http [ACK] Seq=119 Ack=65178 Win=159744 Len=0 TSval=297770909 TSecr=297770807"
"248","0.807645000","10.0.0.3","10.0.0.1","TCP","2962","[TCP Retransmission] [TCP segment of a reassembled PDU]"
"249","0.817684000","10.0.0.1","10.0.0.3","TCP","66","40753 > http [ACK] Seq=119 Ack=68074 Win=165376 Len=0 TSval=297770918 TSecr=297770813"
"250","0.831869000","10.0.0.3","10.0.0.1","TCP","2962","[TCP Retransmission] [TCP segment of a reassembled PDU]"
"251","0.841908000","10.0.0.1","10.0.0.3","TCP","66","40753 > http [ACK] Seq=119 Ack=70970 Win=171520 Len=0 TSval=297770924 TSecr=297770813"
"252","0.880102000","10.0.0.3","10.0.0.1","TCP","2962","[TCP Retransmission] [TCP segment of a reassembled PDU]"
"253","0.890137000","10.0.0.1","10.0.0.3","TCP","66","40753 > http [ACK] Seq=119 Ack=73866 Win=177152 Len=0 TSval=297770936 TSecr=297770822"
"254","0.904313000","10.0.0.3","10.0.0.1","TCP","2962","[TCP Retransmission] [TCP segment of a reassembled PDU]"
"255","0.914357000","10.0.0.1","10.0.0.3","TCP","66","40753 > http [ACK] Seq=119 Ack=76762 Win=182784 Len=0 TSval=297770943 TSecr=297770822"
"256","0.952537000","10.0.0.3","10.0.0.1","TCP","2962","[TCP Retransmission] [TCP segment of a reassembled PDU]"
"257","0.962571000","10.0.0.1","10.0.0.3","TCP","66","40753 > http [ACK] Seq=119 Ack=79658 Win=184832 Len=0 TSval=297770955 TSecr=297770831"
"258","0.851934000","10.0.0.1","10.0.0.3","TCP","66","40753 > http [ACK] Seq=119 Ack=70970 Win=171520 Len=0 TSval=297770924 TSecr=297770813"
"259","0.870070000","10.0.0.3","10.0.0.1","TCP","2962","[TCP Retransmission] [TCP segment of a reassembled PDU]"
"260","0.894286000","10.0.0.3","10.0.0.1","TCP","2962","[TCP Retransmission] [TCP segment of a reassembled PDU]"
"261","0.900166000","10.0.0.1","10.0.0.3","TCP","66","40753 > http [ACK] Seq=119 Ack=73866 Win=177152 Len=0 TSval=297770936 TSecr=297770822"
"262","0.924386000","10.0.0.1","10.0.0.3","TCP","66","40753 > http [ACK] Seq=119 Ack=76762 Win=182784 Len=0 TSval=297770943 TSecr=297770822"
"263","0.942507000","10.0.0.3","10.0.0.1","TCP","2962","[TCP Retransmission] [TCP segment of a reassembled PDU]"
"264","0.966731000","10.0.0.3","10.0.0.1","TCP","2962","[TCP Retransmission] [TCP segment of a reassembled PDU]"
"265","0.972594000","10.0.0.1","10.0.0.3","TCP","66","40753 > http [ACK] Seq=119 Ack=79658 Win=184832 Len=0 TSval=297770955 TSecr=297770831"
"266","0.996834000","10.0.0.1","10.0.0.3","TCP","66","40753 > http [ACK] Seq=119 Ack=82554 Win=184832 Len=0 TSval=297770961 TSecr=297770831"
"267","1.002962000","10.0.0.3","10.0.0.1","TCP","2962","[TCP Retransmission] [TCP segment of a reassembled PDU]"
"268","1.027190000","10.0.0.3","10.0.0.1","TCP","2962","[TCP Retransmission] [TCP segment of a reassembled PDU]"
"269","1.033102000","10.0.0.1","10.0.0.3","TCP","66","40753 > http [ACK] Seq=119 Ack=85450 Win=184832 Len=0 TSval=297770970 TSecr=297770837"
"270","1.057275000","10.0.0.1","10.0.0.3","TCP","66","40753 > http [ACK] Seq=119 Ack=88346 Win=184832 Len=0 TSval=297770976 TSecr=297770837"
"271","1.063407000","10.0.0.3","10.0.0.1","TCP","2962","[TCP Retransmission] [TCP segment of a reassembled PDU]"
"272","0.870053000","10.0.0.3","10.0.0.1","TCP","2962","[TCP Retransmission] [TCP segment of a reassembled PDU]"
"273","0.894273000","10.0.0.3","10.0.0.1","TCP","2962","[TCP Retransmission] [TCP segment of a reassembled PDU]"
"274","0.900194000","10.0.0.1","10.0.0.3","TCP","66","40753 > http [ACK] Seq=119 Ack=73866 Win=177152 Len=0 TSval=297770936 TSecr=297770822"
"275","0.924399000","10.0.0.1","10.0.0.3","TCP","66","40753 > http [ACK] Seq=119 Ack=76762 Win=182784 Len=0 TSval=297770943 TSecr=297770822"
"276","0.942498000","10.0.0.3","10.0.0.1","TCP","2962","[TCP Retransmission] [TCP segment of a reassembled PDU]"
"277","0.966721000","10.0.0.3","10.0.0.1","TCP","2962","[TCP Retransmission] [TCP segment of a reassembled PDU]"
"278","0.972606000","10.0.0.1","10.0.0.3","TCP","66","40753 > http [ACK] Seq=119 Ack=79658 Win=184832 Len=0 TSval=297770955 TSecr=297770831"
"279","0.996842000","10.0.0.1","10.0.0.3","TCP","66","40753 > http [ACK] Seq=119 Ack=82554 Win=184832 Len=0 TSval=297770961 TSecr=297770831"
"280","1.002949000","10.0.0.3","10.0.0.1","TCP","2962","[TCP Retransmission] [TCP segment of a reassembled PDU]"
"281","1.027174000","10.0.0.3","10.0.0.1","TCP","2962","[TCP Retransmission] [TCP segment of a reassembled PDU]"
"282","1.033111000","10.0.0.1","10.0.0.3","TCP","66","40753 > http [ACK] Seq=119 Ack=85450 Win=184832 Len=0 TSval=297770970 TSecr=297770837"
"283","1.057288000","10.0.0.1","10.0.0.3","TCP","66","40753 > http [ACK] Seq=119 Ack=88346 Win=184832 Len=0 TSval=297770976 TSecr=297770837"
"284","1.063396000","10.0.0.3","10.0.0.1","TCP","2962","[TCP Retransmission] [TCP segment of a reassembled PDU]"
"285","1.087617000","10.0.0.3","10.0.0.1","TCP","2962","[TCP Retransmission] [TCP segment of a reassembled PDU]"
"286","1.093514000","10.0.0.1","10.0.0.3","TCP","66","40753 > http [ACK] Seq=119 Ack=91242 Win=184832 Len=0 TSval=297770985 TSecr=297770847"
"287","0.920268000","10.0.0.3","10.0.0.1","TCP","2962","[TCP segment of a reassembled PDU]"
"288","0.920375000","10.0.0.3","10.0.0.1","TCP","2962","[TCP segment of a reassembled PDU]"
"289","0.934421000","10.0.0.1","10.0.0.3","TCP","66","40753 > http [ACK] Seq=119 Ack=76762 Win=182784 Len=0 TSval=297770943 TSecr=297770822"
"290","0.944470000","10.0.0.3","10.0.0.1","TCP","2962","[TCP segment of a reassembled PDU]"
"291","0.982637000","10.0.0.1","10.0.0.3","TCP","66","40753 > http [ACK] Seq=119 Ack=79658 Win=184832 Len=0 TSval=297770955 TSecr=297770831"
"292","0.992678000","10.0.0.3","10.0.0.1","TCP","2962","[TCP segment of a reassembled PDU]"
"293","1.006859000","10.0.0.1","10.0.0.3","TCP","66","40753 > http [ACK] Seq=119 Ack=82554 Win=184832 Len=0 TSval=297770961 TSecr=297770831"
"294","1.016898000","10.0.0.3","10.0.0.1","TCP","2962","[TCP segment of a reassembled PDU]"
"295","1.043138000","10.0.0.1","10.0.0.3","TCP","66","40753 > http [ACK] Seq=119 Ack=85450 Win=184832 Len=0 TSval=297770970 TSecr=297770837"
"296","1.053179000","10.0.0.3","10.0.0.1","TCP","2962","[TCP segment of a reassembled PDU]"
"297","1.067323000","10.0.0.1","10.0.0.3","TCP","66","40753 > http [ACK] Seq=119 Ack=88346 Win=184832 Len=0 TSval=297770976 TSecr=297770837"
"298","1.077383000","10.0.0.3","10.0.0.1","TCP","2962","[TCP segment of a reassembled PDU]"
"299","1.103539000","10.0.0.1","10.0.0.3","TCP","66","40753 > http [ACK] Seq=119 Ack=91242 Win=184832 Len=0 TSval=297770985 TSecr=297770847"
"300","1.113591000","10.0.0.3","10.0.0.1","TCP","2962","[TCP segment of a reassembled PDU]"
"301","1.127763000","10.0.0.1","10.0.0.3","TCP","66","40753 > http [ACK] Seq=119 Ack=94138 Win=184832 Len=0 TSval=297770991 TSecr=297770847"
"302","1.137801000","10.0.0.3","10.0.0.1","TCP","2962","[TCP segment of a reassembled PDU]"
"303","1.163977000","10.0.0.1","10.0.0.3","TCP","66","40753 > http [ACK] Seq=119 Ack=97034 Win=184832 Len=0 TSval=297771000 TSecr=297770853"
"304","0.976769000","10.0.0.3","10.0.0.1","TCP","2962","[TCP Retransmission] [TCP segment of a reassembled PDU]"
"305","0.986807000","10.0.0.1","10.0.0.3","TCP","66","40753 > http [ACK] Seq=119 Ack=82554 Win=184832 Len=0 TSval=297770961 TSecr=297770831"
"306","1.012998000","10.0.0.3","10.0.0.1","TCP","2962","[TCP Retransmission] [TCP segment of a reassembled PDU]"
"307","1.023046000","10.0.0.1","10.0.0.3","TCP","66","40753 > http [ACK] Seq=119 Ack=85450 Win=184832 Len=0 TSval=297770970 TSecr=297770837"
"308","1.037219000","10.0.0.3","10.0.0.1","TCP","2962","[TCP Retransmission] [TCP segment of a reassembled PDU]"
"309","1.047249000","10.0.0.1","10.0.0.3","TCP","66","40753 > http [ACK] Seq=119 Ack=88346 Win=184832 Len=0 TSval=297770976 TSecr=297770837"
"310","1.073439000","10.0.0.3","10.0.0.1","TCP","2962","[TCP Retransmission] [TCP segment of a reassembled PDU]"
"311","1.083475000","10.0.0.1","10.0.0.3","TCP","66","40753 > http [ACK] Seq=119 Ack=91242 Win=184832 Len=0 TSval=297770985 TSecr=297770847"
"312","1.097656000","10.0.0.3","10.0.0.1","TCP","2962","[TCP Retransmission] [TCP segment of a reassembled PDU]"
"313","1.107704000","10.0.0.1","10.0.0.3","TCP","66","40753 > http [ACK] Seq=119 Ack=94138 Win=184832 Len=0 TSval=297770991 TSecr=297770847"
"314","1.133888000","10.0.0.3","10.0.0.1","TCP","2962","[TCP Retransmission] [TCP segment of a reassembled PDU]"
"315","1.143924000","10.0.0.1","10.0.0.3","TCP","66","40753 > http [ACK] Seq=119 Ack=97034 Win=184832 Len=0 TSval=297771000 TSecr=297770853"
"316","1.182098000","10.0.0.3","10.0.0.1","TCP","2962","[TCP Retransmission] [TCP segment of a reassembled PDU]"
"317","1.192143000","10.0.0.1","10.0.0.3","TCP","66","40753 > http [ACK] Seq=119 Ack=99930 Win=184832 Len=0 TSval=297771012 TSecr=297770865"
"318","1.218332000","10.0.0.3","10.0.0.1","TCP","2962","[TCP Retransmission] [TCP segment of a reassembled PDU]"
"319","1.087631000","10.0.0.3","10.0.0.1","TCP","2962","[TCP Retransmission] [TCP segment of a reassembled PDU]"
"320","1.093499000","10.0.0.1","10.0.0.3","TCP","66","40753 > http [ACK] Seq=119 Ack=91242 Win=184832 Len=0 TSval=297770985 TSecr=297770847"
"321","1.117733000","10.0.0.1","10.0.0.3","TCP","66","40753 > http [ACK] Seq=119 Ack=94138 Win=184832 Len=0 TSval=297770991 TSecr=297770847"
"322","1.123861000","10.0.0.3","10.0.0.1","TCP","2962","[TCP Retransmission] [TCP segment of a reassembled PDU]"
